Lovely hotel in a great location for a 4day visit to Pisa and the surrounding area.	Situated just across the road from Pisa central station, it really couldn't of been any better for our first visit to Pisa.	A shuttle bus operates from the airport to the central station, a short 10min or so bus ride, really easy and cheap.	The hotel staff were all really helpful and friendly and the bedroom was great.	A really clean hotel, brilliant size and comfortable bed.	All of the facilities were superb, really top quality.	Breakfast was great, fresh food and a wide choice of different foods, fresh fruit, continental ham, cheeses etc...just fantastic.	Would recommend anyone visiting Pisa to stay here.	Only a short walk to the shopping area and a walk away from the leaning tower...great, great, great....
This is a nice NH hotel in the centre of Pisa.	Right across the Central train station.	Walking distance from all shops etc.	About 20 minutes walk to the leaning tower of Pisa.	The hotel has rooms which are refurbished and these are great and modern.	They have a very good breakfast selection.	And it's not an expensive hotel.	So for a visit to Pisa, good choice for your hotel.
I usually stay in this hotel when I'm in Pisa.	The hotel is directly opposite to the Central Train Station and is close to everything, about 15-20 minutes to the tower.	Parking is available at the hotel or outside, both options are costly.Internet works better than many other places, 	but still slow and not reliable.	The room is nice and small.	Breakfast is very good.
The best thing about the NH Cavalieri hotel is that it is opposite Pisa's main train station, so it's perfect for travel to the airport (6minutes) or any other city in Italy.	I would have scored them slightly higher, if it weren't for the hotels and BBs we stayed in before my arrival.	The balcony on the 5th floor was nice and the inclusive breakfast (we got a deal) was good, too.Unfortunately for them, we stayed in 2 great hotels/BBs in Florence prior to our arrival and I have to say, the service at the NH was not up to par.	It was not terrible, 	but with the others - from the initial friendly greeting to the personal service we received throughout our stay, the NH hotel could not compete.While checking in, the NH asked me to sign up to their marketing scheme.	When I refused, they said it was not for marketing purposes, 	but to make checking-in easier the next time around.	Sadly for them, I've stayed at NH hotels before (and accidentally signed up to their marketing scheme) and every check-in is still long and laborious.	I also receive unwanted junk emails from them.The hallway smelled of cigarettes, 	but thankfully, the room didn't.	The bathroom needs a major overhaul to bring it into the 21st century.
Booked 1 night here in a standard room.	I was already aware that the main pictures of the rooms were of the superior rooms and not the standard rooms.	But the room we were put in was a new one so I assume a free upgrade was given!The rooms were clean and large.	The bathrooms were very modern and had a lot off free shampoos and soaps etc.	The breakfast was in the main restaurant which is nice and they served a wide selection of things.	The best breakfast throughout all my tour of Italy.	Overall id recommend the hotel for the superior rooms!	cant judge the standard ones having not stayed in them.	The staff are friendly and the place is very clean and central, opposite the station!
We stayed at this hotel for 2 nights in August  then again for 1 night at the beginning of September.	My husband  I booked a superior room for ourselves for all 3 nights  a standard room for our daughter  her friend for the 3 nights.	For the 1st 2 nights our daughter was upgraded so they also had a superior room, which was nice.	However, they did notice the difference when we returned for the 3rd night  they just had a standard room, which was in desperate need of a renovation - it appears that half of the hotel has been renovated, 	but not the other half.	Buffet breakfast was very good.	Hotel "bar" seemed to be permanetly closed.	Hotel was right opposite the railway station, so very convenient for on-going travel or days out to Florence, Lucca or the coast.	We took a taxi from the airport to the hotel which only took about 5 minutes and cost 10 Euros.	There were not many restaurants in the direct area, 	but we did find a lovely traditional Italian restaurant over the back of the hotel.	Approximately 20 minute walk to the Leaning Tower of Pisa, which is definitely worth a visit.
When we arrived the modern decor was promising and the concierge was initially helpful... to a point where he then stopped being interested!	We were quite early and they found us a room which was a nice thing to do except that it was a hideous, tiny, dated, smelly dungeon of a thing with a delightful view of the hotel's massive air-conditioning system.	It was stuffy too bc in spite of having a full view of the internal workings of the hotel's heating and cooling, our aircon was about as powerful as my great grandma's breath.	The bathroom was functional, just, 	but mouldy and gross in he base of the shower, furthermore there was a weird, rather cool stash of bathroom goodies in tangerine and lime that looked like it belonged in a hotel that cared.	The bed was potentially comfy had I had it to myself, 	but 	even though I'd requested a twin room bc traveling with my 8 y/o, we got a double that was really closer to a king single so we spent the night kicking each other.	Breaky was good I thought except devastatingly included only that disgusting percolated coffee from a 'stay hot' thingie and no real coffee...this is an absolute sin in Italy and cause alone for never going back.	It was insanely easy to reach from the station and equally easy to access the airport via 5minutely buses from the front door 	but they were the highlights....for gods sake don't go there for a romantic getaway!
My husband and I stayed in the hotel for one night on our way up north toward Venice.	We were coming from Rome via train and wanted a quick stop in Pisa to see the Leaning Tower and break up what would have been a very long train ride straight up from Rome to Venice.	We choose this hotel based on the fact that it was right outside the train station (literally across the street!)	so it was very convenient if you are coming and going by train.	Yes, as others have noted--the train station is kinda "shady".....	but what train station isnt?!	I dont think I have been to any major train station anywhere in the world that wasnt a little run down outside with some questionable characters hanging around.	We never felt unsafe and the hotel also felt perfectly safe.	Yes, it is a bit of a walk to the Field of Miracles, however if you make it part of the experience, it is a very easy and enjoyable 20 minute walk that will allow you to see the rest of Pisa aside from the only major tourist attraction in town.	As for the room, we loved it!!	I booked a regular room (which I am sure is one of the disgusting ones people have posted pictures of) however, upon check-in we were upgraded to the superior room--the ones advertised on their website.	It was very modern, clean, and spacious with all the amenities you could ask for.	The breakfast buffet was included in the price and it was a generous spread by European standards--including eggs, fruit, breads, cheeses, and cereals.	The free internet in the lobby was also a plus!	I would recommend this hotel in a minute!	It was the one I questioned most before arriving due to other reviews, yet out of the five hotels my husband and I stayed at while in Italy, it was our favorite, and unfortunately we were only there for the night.
Bus from airport stops right outside the door.	Hotel right opposite the station.There was no noise from outside, which did surprised us..We stayed twice, the first time we arrived early , however they had a room ready 111 which was lovely, cherry wood.The second time they stored our luggage until the room was ready.	The room was very large, a disabled room, 	but needed updating.	(hairdryer needs re-positioning when they update room -far too high)  staff were helpful and polite, good location for transport
If you are travelling to Pisa by train the hotel is literally outside the train station and you can't get any closer to it.	The hotel is fairly new looking and modern and the room was very clean.	We only stayed one night 	but it was fine.	It took about 20 minutes to walk to the Tower.	We arrived in the morning and they were kind enough to hold our luggage in storage for us until the room was ready.	Wifi was very fast and it was very quiet in the room, considering it was right outside the train station.
We booked this hotel quite a time ago and on coming were surprised to learn that due to overbooking our room will be available only by 8 p.m. That made us to change our plans substantially.	The staff was very kind to suggest us a "complimentary excuse", as well as a small discount, and at the end the room was not so bad.	Although the breakfast was not of the regular NH quality we are used to).	Anyway this will not prevent us from using NH hotels!
We stayed here for 2 nights in May.	The front desk staff were helpful; the bus for the Leaning Tower leaves from immediately outside the hotel and one of the receptionists showed us a good walking route back to see the main sights.	We then spent the next day in Lucca travelling by train.	We had asked for a quiet room and 	though our room on the 5th floor was at the front of the hotel facing the busy square by the station we heard no noise.	Our room even had a little balcony with a table and chairs.	We thought the breakfasts were excellent and again the staff in the breakfast room were very helpful.	We would stay here again
A really nice hotel, decor was modern, bed was comfortable and our stay was a pleasant one.
First of all the hotel.	This is the second NH hotel I’ve booked, the first one was in Rome last year and I like the chain.	I booked a superior room and it was fine 	although they put us in one with a disabled bathroom.	Good walk in shower 	though.	The breakfast was a bit disappointing compared to the Rome hotel 	but it had fruit, cereals, meat and cheese and eggs and bacon and croissants.	They serve from 7am to 10.30am which is great if you are on holiday.	Overall the room and the hotel were clean and efficient.	Now for the location.	It’s great if you want to travel around as it’s just across from the train station and bus station.	We went to Florence, Lucca and a little place on the coast called Viareggio.	Like all train stations there are homeless people in the vicinity and if you are put off by them then it’s not the place for you.	If you are looking for somewhere more romantic then you will have to stay near the tower.	However, once you’ve seen the field of miracles and the centre then there isn’t much more Pisa has to offer so it’s a trade off as to what you want.	The airport is really close to the town too which is handy.
We booked the hotel for one night incl.	breakfast, before an early flight out of italy.	We were positively surprised by the room.	The location is good, as everything in the center is in walking distance (campo about 20 minutes).	A big minus was the service.	We asked if we could get a breakfast to take out the next morning, as it was included in the price.	The only answer we got was: This is not possible.	Over there is a coffee mashine, where you can get acoffee in the morning.
A nice clean hotel opposite the railway station (also 5 minutes from the airport).	Good things are that the room was clean, the deal was reasonable and everything worked.	not so good was that check in seemed to take an age, the bar was totlly soulless, and the bed cover was minimal so I froze.	Breakfast was fine 	but nothing special
We have stayed in this hotel a number of times over the years, and have noticed improved room facilities and considerable refurbishment.	The location is excellent for what we need, being a 10 Euro cab fare (this hasn't changed for years!)	from the airport and facing the square outside the rail station.	Rooms are bright, modern and airy, 	though not all face the Piazza.	If you just want an overnight stay, it's perfect.	Also, a short train ride away is the wonderful old town of Lucca, where you can wander on the top of the old city walls the meander through the narrow streets.	If you're lucky, like us, there'll be a market taking place.	The one we enjoyed was devoted to antiques.If you want to visit the tower, baptistry and cathedral, it's approximately a 30 min walk past shops, restaurants and other squares, with the bridge over the river Arno splitting the walk into two halves.	Easily managed unless you have serious walking difficulties.One of the best features of the hotel is its restaurant - generous helpings of seriously good food, wonderful service and an excellent wine choice.	We planned our last visit after 2 weeks in the Tuscan hills to finish with a lovely meal and a bottle of Vernaccia.	Unfortunately the restaurant was closed that night (a Saturday) and the always friendly, efficient staff were most apologetic, 	but no-one could offer an explanation.	Luckily there are other restaurants in the vicinity, 	but they're really not a patch on the Cavalieri.	Shame!	But better luck next time we hope.
I really enjoyed my stay in this hotel, if we considered the room and the great bathroom.	The breakfast was ok and with plenty of choice.Regarding the negative aspect, and the reason why I do not rate it better, it is concerning the way that the reception handles your arrival and departure.	They were not really warming and provided me a card key that did not work.	When I went to the reception so they could activate the card key, not even an apologize or a work regarding their mistake.If you go for the rooms and do not mind regarding the customer service, this is a perfect hotel.
When your greeted like they do not want you there it's s huge problem This hotel does not offer any porter service we had to lug our bags up to our rooms Room was small breakfast was the best part No information there breakfast was or any other facilities
My room was the size of a postage stamp.	I met another single woman traveler (on the train to Siena) who stayed at this hotel as well, and we both came to the same conclusion about this hotel.	- definitely did not look like the corporate website photos.Without question, the hotel is centrally located.The room amenities were ok, the soaps/shampoos were probably the nicest part of the stay.	Breakfast was good.	Internet usage was intermittent.	I would probably not stay there again simply because I expect more for what I paid.
I stayed there for one night with my family.	We booked two rooms, one of them with twin beds.	At the arrival, there was no possibility of twin beds.	Ok, they offered us a suite for four people instead which was indeed a loft with a living room in the lower floor and two beds with two complete bathrooms in the upper floor accesible through a spiral staircase.	It sounded perfect.	When we get into the room, the airconditioning didn&#39;t work.	The upper floor of this lovely loft-suite does not have any window to the street, so no fresh air.	I phoned to the reception and the sir at the reception told me that "it was my feeling, because the airconditionning worked perfectly".	All this with a smile, of course.	I insisted, the maintenance guy came and indeed he agreed with me that the aircon didn&#39;t work.	It was like a microwave oven ( August, Italy).	I phoned again to the reception to exige another room.	I just got an unintelligible speech in italian English, quite upset, italian style, and finally hung me up cutting me short.	I felt like a .....(imagine the word).	Finally, after some minutes, I received another call telling me that, misteriously, there was another suite for four people.	I visited it and the aircon worked perfectly, so we took it.	Frankly, Additionally the area is a very bad one.	Very close to the station, crowded...</span><span class=fullText hidden data-hiddenOnPageLoad=true>I stayed there for one night with my family.	We booked two rooms, one of them with twin beds.	At the arrival, there was no possibility of twin beds.	Ok, they offered us a suite for four people instead which was indeed a loft with a living room in the lower floor and two beds with two complete bathrooms in the upper floor accesible through a spiral staircase.	It sounded perfect.	When we get into the room, the airconditioning didn't work.	The upper floor of this lovely loft-suite does not have any window to the street, so no fresh air.	I phoned to the reception and the sir at the reception told me that "it was my feeling, because the airconditionning worked perfectly".	All this with a smile, of course.	I insisted, the maintenance guy came and indeed he agreed with me that the aircon didn't work.	It was like a microwave oven ( August, Italy).	I phoned again to the reception to exige another room.	I just got an unintelligible speech in italian English, quite upset, italian style, and finally hung me up cutting me short.	I felt like a .....(imagine the word).	Finally, after some minutes, I received another call telling me that, misteriously, there was another suite for four people.	I visited it and the aircon worked perfectly, so we took it.	Frankly, Additionally the area is a very bad one.	Very close to the station, crowded with beggars and very strange people.	Frankly, it is frustrating when somebody is cheating you with a wide smile in your face.</span><span class=taLnk ulBlueLinks moreBtn onclick=widgetEvCall('handlers.clickExpand', event, this);>More</span>
I've only stayed one night in this hotel and rate it based on my general impression of Pisa as town.	The hotel is perfect for stopover (it's right in front of the train station and only 9 euro away from the airport by cab).	It is not what I would choose for longer stay or a touch of luxury.	What you get is a small room with antique tv, depressing bathroom, 	but clean bedding and semi functioning shower and WIFI.	Breakfast basic 	but fresh.	Regarding Pisa as destination -  I've just cancelled the rest of my stay.	Poor, run down surroundings.	Not much to do after seeing few buildings.
Beautiful hotel, exactly what you'd expect from a chain 4* hotel.	I did have low expectations due to the tripadvisor average score of 3.5*- I don't know why it is so low.	Breakfast was included and had lots of choice.	Staff were helpful and explained how to get around the city.	Location was perfect- right next to the train station (you can see the hotel from inside the station!).	My only problem with this hotel was that it was in Pisa.	It isn't really a nice place.	Stay one night if it is convenient for the airport and see the tower, then leave!	If you aren't flying from Pisa, I would really recommend a day trip.
Modern hotel just across the road from the railway station, Stayed one night in August as we were then traveling  on to Florence by train.	Room was clean and  bed was large and comfortable.	Breakfast was ok, Italy is not in my experience know for good breakfast.	Carpets on landings and corridors stained and dirty.
I spent one night in this hotel.	It is just right in front of Pisa central station.	I traveled with my parents so they just put one extra single bed in the room.	The room was nice and clean.	Only thing I would criticize is front desk staff.	I didn't feel they were too friendly.	There were no smile on their face.	But other than that, it's a nice hotel.
Great reception staff.	Faultless check in and friendly welcome.	Everyone on reception  were very  pleasant and welcoming.	Our safe would not open one night and after a quick call to reception the nice man came up immediately to try and get it sorted.	Stayed for five nights.	Room clean, functional and adequate for our needs.	Bathroom was nice and clean with plenty of hot water for the shower.	The beds were very comfortable.	Shame only enough tea and coffee left for one drink.	Would have been handy to have had a couple of drinks each day last thing at night and one for the morning.	Close to the station which enabled us to explore Tuscany by train.	Florence, Cinq Terre, Sienna and a twenty minute walk through the town to the Duomo and Leaning tower.	Plenty of restaurants in town.	I would not recommend the cafe's near the hotel.Hotel was nice and quiet despite being near the station.	No noise in the hotel at all which enabled us to have a great nights sleep.	Breakfast was well prepared and easy to help yourself.	The only down point I would make about the hotel is that  they do not offer meals in the evening only breakfast.	There is a vending machine in the lobby area 	but it would have been nice to have had a nice meal in the evening.	You can have a quick breakfast before 07:00 or afterwards up to 11AM or 12 on Sunday or something more substantial after 7.All the staff we encountered were very cheerful and helpful too which was a bonus.	I would have no hesitation in staying here again!
Myself and daughter stayed for 3 nights from April 2nd 2017, we had room 409 overlooking the train station.Not much storage space, small wardrobe, which did have a safe in, 	but no drawers so had to keep items in case.Bedside tables didn't even have a drawer in.The room got so hot at night it was hard to get any sleep, when I mentioned it to reception they just said the air con isn't on in April.With rooms as hot as they were I think it should be available all year, we could hear other quests complaining about it too.Location was good, so handy for train station, and we walked everywhere from hotel.
NH hotels tend to be reliable and if you are using Pisa station then this is a good place to stay.	Not the best neighbourhood 	but that is typical of areas around stations.	Room was comfortable if small and everything you need.	Breakfast a little standard and unexciting Service was good especially from reception.	Good business hotel
Stayed a night in the NH Pisa and I thought it was better than expected.	Modern design 	but with a bit of a chain feel.	Rooms were comfortable and shower was good.	Location was great - very close to station.	Much better than what the reviews made it look like.	Main drawback was how long it took to check-in.
We have stayed in several NH Hotels previously and this hotel is extremely disappointing.	The room is ok - it is a standard room and the bathroom is a bit tired and grubby.	There are some water marks on the ceiling and walls leaks from the upper floors.	No tea making facilities.	Location is fantastic 	though as it is very close to the station and city centre.	But, most disappointing is the disengaged attitude from the reception staff and lack of bar/24 hour facilities.	There is a vending area in reception which has very little stock: no cups for coffee (and despite requests these were not replenished), no fresh fruit etc.	We have ALWAYS enjoyed our stays in NH Hotels 	but not this time.
I booked a non-smoking, "superior room" 	but there was absolutely nothing superior about it - have a look at my photos.	When I entered the room, it was stinking of cigarettes so I returned to the reception to ask for a different one.	I was told by one of the employees that "it was a non-smoking room 	but maybe people smoke in it" (???)	- the most ridiculous explanation I'd ever heard in my life.	He wasn't really interested in solving my problem so I just had to return to my room and keep the windows opened for some time.	I don't smoke so sleeping in such a stinking room was VERY unpleasant for me.	I found numerous cigarette marks in the room (see my photos) so obviously it was a smoking room and the way the receptionist lied to me was just unprofessional and simply rude.	The "superior" bedding turned out to be an ugly black blanket  a white sheet - neither comfortable nor very hygienic.	The "superior" shower didn't work.	The staff in charge of the breakfast were very welcoming and really seemed to care 	but the breakfast itself was rather poor - a few slices of ham and cheese, some scrambled eggs, milk, yoghourt, croissants and that's mainly it.	It doesn't sound very bad 	but it's supposed to be a 4-star hotel so I was expecting much more.	In a nutshell, I can't imagine why this hotel has 4 stars and, mind, my experience is based on a stay in a "superior" room, I can't even imagine what the standard rooms look like.	I don't recommend this hotel to anyone, unless you like to be ripped off.
My wife and I stayed in this hotel for a week in November and found it an excellent place to base ourselves as, being so close to the station, it was easy to go on trips to Florence, Livorno and Lucca, as well as forays into Pisa.	Being so easy to access the hotel from the airport is another big plus in terms of easing the hassles of traveling.	OK it is not in the centre of town 	but walking or taking the bus into and around town gices you an excellent feel for Pisa, its people, and the way it works.	OK the rooms are small, 	though perfectly adequate, and the staff friendly and helpful.	An excellent and tasty breakfast spread of options was a welcoming way to start the day.	The hotel appears to be hard used and therefore could do with a bit of freshening up, such as corridor carpets.	Although the rooms are generally well cleaned, serviced with excellent beds and bedding there is a lack of attention to cleaning in corners.	If I get back to Pisa again I would most assuredly stay at this hotel again.
