Check in quick and effortless.Room  tired decor, 	but clean.	The bathroom a bit mildewy and 3rd bed, really just slung in by the window.Workmen started angle grinding and hammering at 9- 7 in the room opposite :( Breakfast not included, so costs 15 Euro each unless you go elsewhere.Not much to do or eat at in the area, 	but good transport links.If I did my holiday again I would stay at viareggio and travel to the sites from there.
My overall experience was OK: welcoming staff, stylish lobby and breakfast area, and an overall feeling of efficiency.	On the other hand, a big plant running 24/7 in the backyard was a bit noisy and my room looked somewhat tired: everything was in good order 	but the furniture has a distinct vintage feel.	Only a handful of power sockets were available, mostly of an old type which doesn’t accept modern travel adaptors.	Despite some minor glitches, a pleasant stay.
We booked this hotel based on the reviews, past experience with the NH brand and its location.	The hotel is situated right across from Pisa Central Station (main entrance).	As soon as you step out of the station you will spot it.	The hotel itself is clean and quiet despite being across the station.	The room we were allocated had a  balcony and a view of the station.	We were on the 5th floor so we had a good view.	The room itself could do with a little bit more wardrobe space, particularly for those of us who are staying more than one night, and could do with some racks for luggage bags to make it easier to pack, repack, unpack etc.	Other than this minor criticism the room was clean and the bed comfortable.	Free wifi is available and works fine.	We had breakfast in the hotel (we went for the included breakfast option).	The pastries are good and the selection is wide, plenty of fresh salads and tomatoes.	There were options for juices, cereal, teas and coffees, plenty of options for vegetarians, and there is rice milk as well.	To get to the leaning tower, it’s a very quick bus ride, we asked the reception staff who told us that the bus goes just across the road, (in front of the railway station).	You can get a bus ticket from the tobacco shop in the railway station.	It is about 5 mins by bus to the leaning tower.	The hotel is close to several small mini markets where you can purchase water etc.	Just outside the hotel there are some vendors selling various things like scarves, handbags sun glasses etc.	It is quite easy and possible to walk to the main town centre area of Pisa from the hotel, it is about 10 mins to the river and just across the river is the main town centre.	There are many restaurants and ice cream (gelato) vendors in the main centre, as well as bars etc.	Most restaurants in the town centre open around 6.30pm / 7.00pm for dinner, however the bars offer some food.	Overall the hotel was a good option, and would be happy to stay again if we returned to Pisa
I love the NH chain generally and this hotel generally does not disappoint.	It is 1 minute to the train station and we had a room facing it, 	but there was no noise evident.	AC and WiFi both worked well and complimentary breakfast was good and varied.	We had a room on the 5th floor with a balcony, which was nice.	So while there are many good points about this hotel, 	but equally it is not special.	If you are visiting Pisa, its a 20 minutes walk to the tower.	If you are using Pisa as a base to discover Tuscany by train, this is ideal.
This hotel is opposite the Pisa Centrale train station which is ideal if you are city hopping on your holiday or if you want to head away for a day trip.	The lobby is modern and clean and the staff welcoming.	The beds are huge, I was expecting a double/twin and we received a super-king which was great and very comfortable and is quiet at night with no train noise.	Minor cons would be the breakfast (fair range 	but to be honest not all that appetising in my opinion) and the shower-over-bath's glass screen only partially covers the shower's spray so you end up with a wet floor - other than those minor faults, would definitely recommend.
We picked this hotel because it is directly across the street from Pisa Central train station.	Check in and check out was easy.	Our room was clean and quiet.	The beds were comfortable.	Tower of Pisa is about a 20-25 minute walk 	but we opted for the bus (10 minute ride) which is located right in front of the train station.	There's also a small grocery store close by and a bunch of restaurants.	Definitely recommend this hotel.
Stopped here for convenience for our flight from Pisa.	Near to the train station, clean entrance and welcoming staff.	We left our luggage there before check-in whilst we explored Pisa.	The room was a bit small 	but a good price with good facilities.	Breakfast was nice 	but don't expect a huge selection.
The Hotel's location is really good, we stayed 2 nights, it is right opposite the main station (where we took the direct train to Florence, around 8 euro for a single adult ticket).	The hotel is also within walking distance to the leaning tower of Pisa.	We flew to Pisa airport from London Heathrow, there is a frequent bus service to and from the airport and pisa central train station (around 1.30 euro if you buy the ticket at the airport or you can buy ticket on the bus for a little bit more).The hotel staff are very friendly on average.	When we were going to the room, we noticed half of the corridor is new and modern and the other half is old.	Unfortunately, we got put to the old half and no surprise, our room is very dated inside and small also (	but relatively clean), unlike the main hotel photos, which showed a very modern green colour themed room.	Our room does have a big flat screen tv which we didn't use, a mini bar, no kettle, a very old looking safe and a small wardrobe to hang our coats.Inside the room, there are windows which you can open very wide, enough to climb out easily.	The room we had was really warm, we tried not to open the window when we sleep as we didn't feel safe to leave it opened all night, we turned the heating off and yet it was still too warm.	I called the reception twice, first time they said they will check, we then went to sleep with the ''air condition/ heating'' switch set to 10C 	but then we woke up in sweat during the night.	I then called the reception again 	but was told to turn the heating off (which we did earlier that night 	but had no effect in cooling the room) and there was nothing else they can do.	We had no choice 	but to leave the window open for the night, I did not sleep well that night and a little disappointed.
Across from train station.	Would be noisy with window open.	Room is small 	but bed was very comfortable.	Room and bathroom were clean.	Carpet was a little worn.	Wonderful buffet breakfast in large room off lobby.
Would happily recommend this hotel.	It's not a hotel full of character and history 	but it is a modern and very adequate hotel for a couple of nights in Pisa.	It's is opposite the train station (which links to Pisa Airport in 8 minutes or Florence direct in 1 hour) and is about a 20 minute walk from the Leaning Tower.	The walk is along a dead straight road with shops and eateries and no cars are allowed so it is a nice walk.The breakfast buffet was very good with a great variety of food.	The receptionist was helpful and pleasant.	The room was clean and well stocked.	Modern.	Nice shower.	Not huge room 	but enough for what we needed.	Hairdryer in bathroom pretty good too.I can imagine people worrying about noise from trains, 	but I honestly did not hear anything and wouldn't let that put you off.
Good for arrival and departure as it is next to the station.	A long walk to the leaning tower 	but the town is very pleasant so no problem.	Standard quality 	but clean and adequate.	Internet very very slow 	but free.
location is the best, it's very close to the train station, so surprise it just located opposite to the train station !	the room is decent and clean, friendly and helpful staff as well, we certainly enjoyed the breakfast,which was included in our package, everyday.	Having stated all the positives above, the only cons is you have to get the wi-fi login name and password from the front desk every 24 hours, overall a nice accommodation that is icing on the cake of our fantastic visit of Pisa....
check in not until 3pm, friendly staff, right outside train station we had lovely standard room for 1 night , they had special offer on for evening meal for €19 p.p which we ended up with ,it was lovely and after pricing loads of places as we walked from the tower, we found it to be one of the cheaper options for eating out.,left too early for breakfast, bus to airport is at 5.15am right outside the door so that was great as it was pouring down, €1.50 approx per person fare can pay the driver or get ticket in the ticket macine, 5 mins to airport, 15-20 mins walk to the tower through the shopping streets, buy ticket first at ticket office before queing at the tower as ticket will give you a time to queue at.	also you have to leave shoulderbags/bagpacks at the ticket office they are not allowed in the tower, 300 spiral steps to go up 	but there are little parts to stop every 50 steps or so.	you only get 1/2 hour in total up and down to take photos before you are asked to leave, hence your time on the ticket.	€18 per person to see tower and cathederal, the other venues are extra.
Stayed here for a night and was happy with it.	The location is handy as it is right beside the train station.	It's about a 15 minute walk to the leaning tower.	Some of the rooms are newly decorated and some haven't been re-done yet.	Our room was an older room.	It was clean and spacious.	Breakfast was ok, nothing special- some croissants, cereal, tea/coffee.	I would recommend this hotel, it was good value.
A pleasant hotel right near the train station.	The room, 	although slightly small was very clean-as was the whole hotel- with a bed that was so comfortable!	Staff were very friendly and attentive 	although at times there didnt seem to be many of them around!	Good location for the sights if you want to go and see the tower etc.	Just jump on LAM Rosso and your there in 10mins- it will pick you up right outside the hotel!Didnt try the food 	but looking at the menu I was glad we chose places in the town each night of our stay as the choice was quite limited.	We would stay again if in the area.
Spent 3 nights here with daughter so that we could visit Pisa Florence and Lucca.	The hotel is opposite the station so made travelling easy as plenty trains to these locations.	Train from airport or Red Bus.	As Pisa is quite compact it was an easy walk throught the centre of town to the Tower etc.	There are some nice shops enroute and a variety of restaurants.	Around the hotel is a bit grim after dark, 	but the hotel itself is very nice.	The staff were very helpful and the rooms very modern with flat screen TV and plenty storage for a short stay.	The Bathroom was a bit of a nightmare as with no shower screen the water went everywhere, 	but the hairdryer was good and the bathroom a good size.	The public area are light and airy and the bar prices fair.	The breakfast provided good coffee fresh juices,fruit,cereals as well as cold meats and bacon and eggs.	We did not like to be out after dark as the area around the hotel seems to attract a lot of people with no apparent reason for being there which unnerved us.	During the day there are a lot of sellers who were annoying rather than intimidating 	but nevertheless not welcome.	We would not stay in Pisa again 	but much preferred Lucca 20 mins away by train as it was quieter and more traditional.
Stayed for one night before heading off to Florence for Easter weekend.	Nice hotel, staff, clean rooms etc.	Location is ideal, just opposite the train station.	However, it's not very pleasant to walk to the main street in the evening, lots of people hanging around and found it a bit intimidating.	The hotel is on a very noisy piazza 	but we were impressed that the double windows completely blocked any street noise out.Ended up eating at the restaurant in the hotel because of this and really enjoyed the food and service.	Check your bill carefully when you check out 	though as we had American breakfasts and all sorts added on to ours 	though.	Issue very quickly and efficiently resolved, however.	Overall, a decent hotel that did the job.	We would recommend.
Fantastic place to stay.	Very nice, modern hotel on a very convenient place.	Airport bus stops in front of the door on the regular bus stop, railway station just opposite the hotel.	Only one disadvantage: quite a busy place.	Breakfast excellent, hotel decoration as well.
As other reviewers state, hotel is right by station.	The good breakfast and comfortable bed slightly made up for the substandard room we were allocated - one that sorely needed decoration.	I've had better rooms in Travelodge.Unless you have really heavy luggage, use the Bologna hotel (10 mins walk from station) as we did on our outbound journey.
A reasonable hotel, very convenient for station 	but 20 mins walk to Leaning Tower etc.Small room 	but Ok for one night stay.	Bathroom a little dated 	but clean.
It's not realy good, 	but fun for a couple of nights before leave .	Walking to the closest train station  is  (1 miniute) and in 20 minutes you walk to the hip and nice entertainment district .	However, next time I would chosse a hotel in the city centre .
Flew in from London before taking the train to Florence the next morning.	Rooms were better than I expected clean and big.	The bathroom as well!	!Everyone we dealt with was very nice and you can't have a more convenient location for the train station.Happy with our short stay.
NH Pisa is a nicely appointed hotel ideally placed opposite the central station.	I stayed in a superior room which 	although relatively small provide all necessary comforts; excellent bathroom, wall mounted TV with a range of European channels including news channels in English and a kettle with a small supply of tea and coffee.	The hotel is positioned on the opposite side of the river from the Leaning Tower, 	but is accessible by foot.	The breakfast buffet is plentiful with a range of hot and cold items.	There is a self service area in the hotel lobby that provides ready meals and snacks and a range of drinks, 	but there is no bar.	There are a range of bars and restaurants close by.
The hotel is located very conveniently to the train station.	The rooms were modern and clean 	but lacked a hotel safe (which is unusual for a hotel of this category).	However the main problem I faced was the service from the front desk staff, which I found rude, uncaring and completely unacceptable.	In one instance, the front desk staff actually ignored that we were waiting to ask a question and did not even look up when asked.	From our experience, I find it hard to recommend despite the convenience of the location, especially if you are tourist and may need to seek help from the staff.	I've received much better service from other hotels and would have expected much more from them.
I like this hotel a lot.	We stayed there for 1 night.	First we got free upgrade and got a lovely room on the last floor with a balcony.	The room itself was small 	but very clean and modern.	The bathroom was very beautiful and all hi-tech.	I would also say this hotel had the best breakfast variety from all the hotels we visited in Italy.	Far from boring "continental" breakfast.	It had even lactose-free milk (I think it was rice milk).The location is also great, since it is less then 1 minute walk from the railway station and 20 minutes walk to the Leaning tower.	I would recommend this hotel.
Stayed here for 5 nights and what an excellent location.	We came out of the airport, caught the red line bus which stopped outside our hotel literally 5 mins later and opposite the Central station.	Location was ideal for getting a train to Florence, Lucca and Cinque Terre plus a 20 minute walk to the Leaning Tower.	As for the hotel itself, the rooms were clean and beds very comfortable and with the double glazing no noise at all to be heard from outside.	We were on the fifth floor at the front so had a small terrace which was nice also.	The staff were friendly and breakfast really good, bacon and eggs which tasted really nice and perhaps better than it looked, pastries, yogurts, cereals, continental meats and cheese, etc etc, certainly more than enough to set you up for the walking around.	Cannot fault this hotel, very good value for money in a fairly expensive place to stay.
This hotel is in a great location literally across the road from the train station.	It is just a 5 minute bus ride from the airport to the station so your holiday can start quickly after landing at the airport.	It is a nice walk of about 20 minutes to the Tower and Florence is about an hour away by train.	We had a Superior room with a small balcony overlooking the front to the station, 	but were not affected by any noise at all.	The room was quite small 	but the bed was comfortable and the bathroom clean and modern.	Breakfast was great, plenty of choice.	Staff all pleasant and helpful.	We struggled to find a decent restaurant to eat in in the evenings 	but it was the middle of October so I guess a lot of places had closed for the winter.	However once we got to know the place a bit more, there were restaurants, you just had to look for them.	Would definitely stay here again and recommend to anyone staying in Pisa.
This hotel is superbly placed for the railway station.	It is directly opposite, making traveling around Tuscany by train that much easier.The room was nice and the help yourself buffet breakfast was very good, with a good choice of everything.	Where this hotel falls down is that it does not have tea and coffee making facilities in the room.	Also the coffee machine at breakfast is too busy and it is not the best if you want a cup of tea.	It could also benefit from a bar and restaurant 	although I understand they were in place up to 2015 so wonder why they were removed.The staff were very helpful and friendly and we have to say a very big thank you to Giuliana on reception for going the extra mile.
This hotel is very well placed for the airport with the bus stop literally right outside the hotel and the central station opposite.	We walked to all the sights easily from here, shopping on the way.However, the walls in the rooms are so thin you could hear coughing, the TV etc.	Although the room itself was well appointed, there was insufficient space in the bathroom to put your toilet bags, there was no where in the shower to place soap or shower gel, the extractor fan in the bathroom did not appear to work.	The location of the hotel works, it was nice to be able to open the double doors to let the sun in 	but the noise became too much after a while.	There was a reasonable amount of choice for breakfast 	although it would have been nice if staff brought coffee and tea to the table, instead of guests having to queue for a long time to use the coffee maker which kept stopping after dispensing a few cups.Not sure if I would stay here again 	but the location of the hotel is good.
The hotel is in an excellent location, directly opposite Pisa Centrale Rail Station, so excellent for trips to Florence, Siena, Lucca.	It's about 20 minutes walk to the Leaning Tower, through the shopping and restaurant area of Pisa.	We had a 5th floor room, with a small balcony looking out on to the small piazza in front of the rail station.	The room was clean and functional, 	though a little cramped, and there were no facilities in the room for making hot drinks.	The air conditioning in the room was very good, and allowed a sound night's rest.	The choice of food and drink items at breakfast was good:  breakfast was available 7 - 10 am weekdays, 7 - 12 weekends.
Really nice modern hotel, staff were friendly, hotel was spotless and breakfast was very good, plenty of choice.	We stayed here one night and found the location very good for us .	It is 5-10mins in a taxi from Pisa airport and straight across from the train station.	We walked to the leaning tower and found it easily, the city sight seeing bus stops across from the hotel which would also be good if you were looking to do this.	If we were to go back to Pisa would book this hotel again, great location especially if you are getting the train to go onto another city.
NH Cavalieri is very nice, modern hotel.	Location is good, very close to railwaystation (Pisa).	The personnel is very friendly and helpful.	Room was very clean and well equipped.	The only discomfort was the late check in.	We arrived a little bit before 01:00  pm and we were promised to get our room not earlier than 03:00 pm.
Fab hotel, excellent customer service, lovely rooms, good selection at breakfast and excellent location.I have stayed many times at this hotel in Pisa and no other hotel in the vacinity compares.The quality of this establishment is excellent and having spent other trips staying elsewhere in Pisa , I would always come back here.
What a delight to get off the train and just have to walk 200 meters to the Hotel, especially having to cope with suitcases.	The hotel stored our suitcase whilst we went to Cinque Terre for 1 night, allowing us to take a small backpack each!Hotel Cavallieri were so accommodating.	Gave excellent service, advice and help.	Our hotel room was lovely.	Clean, quiet and comfortable.	Nice toiletries for the bathroom.	No tea/coffee facilities in the room, 	but coffee freely available near the reception after 12 p.m..	Excellent breakfast.	Although it is close to the train station, it was quiet.It is within about 15 - 20 minutes walking distance from the Leaning Tower of Pisa  Cathedral.	A great walk as there is so much to see en route.	The hotel recommended a delightful restaurant for supper that evening.	A lovely stay.	We highly recommend this hotel.
