We arrived for a one night stay on 13 July.	Entered through the front door, two people at reception.	This is our first impression of this hotel,  Went to reception desk and waited.	And waited.	The two people were looking at a PC screen until finally they realised some guests had arrived.	One was a female trainee and the other person, a man, who we assume was fully trained.	We produced our reservation document which was looked at as if it was a foreign document 	but finally we were checked in to room 412.	We also had a motorway toll ticket which we received when the machine did not accept our euro note.	It was all in Italian so we asked for their help regarding payment.	They handed it back to us, no help at all.	So a trainee working with somebody with zero customer service,  a good start to her career.Went up to room 412.	A nice clean room, air con was quiet and the bed was comfortable.	No complaints about the room 	although wifi was weak.Breakfast was good, usual buffet offering 	but we enjoyed it.	Checkout on the 14th professionally handled.All in all a good stay ruined by poor reception staff on the day.
Great hotel location opposite Pisa Central station, you can get the shuttle (Pisa Mover) from Pisa Airport for €3 and 10 minutes  later your are at your hotel.It is within a few minutes from bars and restaurants and a 20-25 minute stroll to the leaning tower.Hotel is nice breakfast is good, rooms as usual for Italy are quite small 	but clean and has everything you need, the only shame is there is no bar at the hotel 	but you are only a few steps from several outside bars so not a major concern.Great base to tour Tuscany, it is 1 minute to train station with trains to all destinations, we went to Lucca only 30 minutes very cheap fare it was I think only €7 euro's return.One last point the hotel staff are great, really helpful and always friendly.	Recommend this hotel, not 5 star 	but really good!
We Stayed at this hotel for a week.	The first impression was good, 	but honestly this place do not look like a 4-star hotel.	Its a nice hotel 	but it realy needs an renovation/refurnish.	You can observe this almost everywere inside.	The breakfast was OK, 	but very booring.	As I mentioned, we were there for a week and EVERY morning it was the same food.	Nothing new or some variations.	Very good beds to sleep on and great wifi.	The aircondition is good 	but very noisy, and sometimes it smells bad from the bathroom.I recommand this hotel if you want to stay in Pisa just for one or two nights.	OR if you want to stay in Pisa 	but travel to other places.	The advantage of this hotel is that it is located 1 min from the Train Station and not so far away from the airport.	We traveled to Carrara, Firenze and Lucca(I realy recommand to see this small city) several times and it was very okei to have the station so near the hotel(btw, you can buy the tickets very easy at the red ticketmaskins in the station.	Card or cash.	BE AWARE OF PICKPOCKETS).	If you want to go to the beach on Tirrania or Marina di Pisa(beautiful places), you can take the bus nr10 from the bus-station 10 min away from the hotel(ask the staff where the corect bus-station is, they will show you on the map.	You buy tickets from the ticketmaskins.	Not in the line).	It takes approx 20-25 min to walk to the Tower.	A nice walk.	The best lunch-restaurant near the hotel is La bottega del Parco 3min away, and another great lunch-place is I Porci Comodi(this one doesnt have tables outside).The best Indian food is at Namaste India Ristorante.	The best dinner you get is at II Bistrot.	Take a break and enjoy a drink at Ristoro Amaltea(waiter Ricardo is the best!).	Use google maps to find these places or ask for the city map from the staff at the hotel.	The staff at this hotel is realy friendly and helpful.	Thank you sweet Laura!	Give this hotel a change if you have a short stay.
A welcome sight to find your hotel right across the street after a long train ride and jet lag.	Conveniently located to find breakfast and it is nice to sit in the air conditioned lobby waiting for your train rather than in the hot crowded station with no place to sit.	The exterior windows are amazingly sound proof, 	but insert earplugs before you realize you need them, because the interior walls are not soundproof and conversations in the hall and adjacent room will disrupt sleep.	Otherwise, clean and modern rooms providing basic needs for a layover.
This certainly isn't the most posh hotel in Italy, 	but it's conveniently located across from the train station, clean, and fine for a night.	The rooms are fairly bare-bones 	but clean.	The breakfast buffet is decent.	The location can't be beat, the staff is helpful and the price is reasonable.	Not an extended stay kind of place, 	but fine for a night or two.
This hotel is very clean and modern, 	although not very sound proof windows allow in the outside noise.	Check in was painful due to lack of available staff, which may have been unusual, 	but maybe not...	Location is very convenient to walking areas, shops, and the station.	Computer did not function, so could not print tickets.	Noticed several guests had issues with room keys, 	but our was fine.	Overall we would recommend this hotel for a short stay, 	but search elsewhere for longer options.
Good hotel overall.	Central location (opposite station), yet quiet, rooms large and comfortable, nice modern decoration throughout, friendly staff and good breakfast.	But ... only one coffee machine for breakfast, only one employee at reception.	Plan to queue at breakfast, check_in, check_out, getting your car out of the garage, etc ... A few details easy to fix 	but which can get really annoying in an otherwise very acceptable hotel.
Great location for station 	but in a run down area[most of Pisa is run down]From here great base to visit this part of Italy.From airport get bus to station cost about 1.20 euro each wayBreakfast not to bad 	but don't expect a good hot selection.My room 406 good size and room service good.	Internet also good.For the money best aroundBus outside hotel for the Tower area 1 euro single walking 20/25 mins
This hotel is very convenient for travel to the airport by either shuttle bus or taxi.	The breakfast is served in a lovely bright room with a fantastic selection of fresh fruit, yogurts, croissants etc,.There is also bacon, eggs etc for those who like an English breakfast.	However,  having started with what I liked about this hotel, regrettably our reservation for a Superior room didn't match our expectations when we arrived.	If this was a Superior room I can't imagine what a standard room would look like.	The room was exceptionally small and the bed was a basic double which was pushed up against the wall.	The person sleeping on the inside would have to climb into bed over their partner or try and slide in by the end of the bed.	As elderly travellers we found this arrangement totally unsuitable.	I thought that perhaps we had been allocated a single room by mistake and therefore asked the receptionist to change the room.	All we needed was a decent size bed with enough space around it to allow us to get in and out of bed in a normal way.After a lot of discussion with her colleague at the reception desk we agreed with the receptionist to be upgraded to a suite 	even though a proper Superior room would have been fine which was what we had booked in the first place.	I got the impression that a suite was the only alternative.	The suite consisted of a living room with a very shaky spiral staircase leading to two bedrooms.	We didn't need all this space 	but the extra tariff was fairly minimal.	The bedrooms in the suite are lit by a small long window at ceiling height so there is no connection with the outside world just a blank wall.	Okay for one night 	but I would not like to stay in this room for any longer.	In the end we had a lovely large bed with crisp linen and had a splendid nights sleep so a happy ending.	I would recommend this hotel 	but make sure that you get what you asked for in your reservation.
Boutique hotel which was tastefully decorated and clean.	Excellent buffet breakfast with a huge choice - only problem was the single hot drinks machine which was very slow, hence there was often a bit of a queue.	Our room (I think No.	202) was clean and well-stocked 	but perhaps not as modern as some of the other rooms.	Excellent location being opposite the train and bus stations and not far to walk into the centre of Pisa.
Here for 2 nights on a city break booked through BA, excellent value.	The staff here are so pleasant and attentive and make you feel welcome.	The bed was large and very comfy and room was sooooo warm on a cold day.	Bathroom was decent size 	but none of the sink plugs fitted which was a challenge.....Breakfast buffet was superb and so much choice.	Recommend this hotel very much.	Its great for shopping areas and transport.	A little on the quiet side in the evening 	but would happily return here.	Thanks NH hotel Pisa
Just across from the main station and just around the corner from the main shopping street.	A clean and well organised hotel.	We had a good room with a small balcony with views over the station.	The hotel was surprisingly quiet despite it great position next to the station.
Originally chose this hotel due to its location across the plaza from the main station.	Staff more than happy to check us in early and friendly and helpful with directions and advice.The room was very large, beds extremely comfortable and a well sized bathroom 	although the shower was over the bath which could be an issue with those less mobile.	Cleaning was to a high standard.Breakfast was amazing with a huge choice of foods from a well stocked buffet.Walk to the Leaning Tower was about 20 minutes 	but plenty to see on the way really the only way to experience a city.Day trip to Lucca by train very cheap and plenty of trains.Would stay here again and always recommend.
Great hotel with a perfect location, just accross the Pisa Centrale.	Stuff is helpful and nice.	Very good breakfast.	we stayed 2 nights and due to the close location to the train station, the visit to Florence was really convenient.	The Leaning Tower of Pisa is like 20 mins on foot.	I was really pleased.	For sure this is my hotel in case of a new visit in the region.	Keep up the great service!
We arrived early to the NH Cavalieri, and I was a little worried having read some negative reviews, 	but thankfully everything went smoothly.	There was no problem and we were given a room straight away.	Check in was a little slow, 	but nothing to complain about.	The room we were given was small, 	but very clean and the bed was very comfortable and fresh.	Toiletries were provided, and a good hairdryer too.	Breakfast was lovely, cheeses, meats, scrambled eggs etc.	The hotel is right across from the station, which was handy as we took a trip to Florence for one day (8 euro each way).	We found the staff very pleasant.	The air conditioning was great, effective and not loud.	About a 20/30 minute walk to the tower.	All in all we were very happy and would go back.	( Taxi from the airport was so handy and cost 8 euro)
Good hotel right outside the station so Airport to room in 15 mins at a cost of euro 1.30.	Warning do not book a taxi especially through Travel Republic they will rip you off by charging £50Opposite end of the town to the leaning tower 	but a nice 20 min walk down the shopping streets Buffet style breakfast included
we used this hotel at the start of our holiday.	Pisa only deserves a one-day visit really and this hotel is located opposite the railway station and only a short 10-ish minute walk to the Leaning Tower area.	It's perfect as a sightseeing location and somewhere where there is easy access to the eating houses
Let's begin with the staff.	Most (almost all) of the staff at this hotel act as 	though they no longer want a job.	They are unfriendly, have an inability to smile, and are attempting to create a corporate feel, 	but have sadly failed in this.I have stayed at this hotel on two separate occasions in the same week, and found that it is definitely worth paying slightly more to lodge in a 'Superior' room.	It has a more modern feel, significantly more powerful air conditioning, a better bathroom, and (as should be standard in my opinion) has a kettle.	However, I must note that in both rooms the soundproofing is excellent.	Additionally, the WiFi worked well in both rooms with no additional charge.	Considering the impersonal and corporate feel of the hotel, it is surprising that their TV channel selection is poor, and flat screen sets are only found in Superior rooms.	Disappointingly, the card keys only worked occasionally, and I had to go up and down the stairs a few times to sort this out.Overall, the hotel is sufficient, and the location is useful, with the train station, and a shuttle bus to the airport on the doorstep.	Also on the positive side, Breakfast at NH Cavalieri is reasonably good, and I particularly enjoyed their panna cotta on a few occasions!	Despite this, I wouldn't stay at the hotel again if I were able to find something else for a reasonable price in the area.
We stayed here for one night on our way to Florence.	We were very impressed by the hotel and staff.	Very clean and modern room, with balcony and view.	Lovely clean bathroom.	We loved Pisa and hope to return to this hotel again!
The hotel is in a great location for access to the main train station and buses.	It is also only about 20 minutes of a stroll from the main sights.	However, the staff were generally cold, unhelpful and sexist preferring to talk to my male partner over me 	even though the booking and payment were in my name.	They went as far as changing the name on the booking into my partner's surname after photocopying our passports.	How rude!	We booked a Superior Room and we did not get a double bed.	Instead we got two singles on wheels pushed together, which moved at the slightest turn.	This was not conducive to a good nights sleep.	The room did not have a spare blanket and was actually cold at night despite turning the air con off.	We did not have bathrobes or a sofa-bed as described in room facilities description.	The room was clean and presentably stylish 	but small.	It did have a nice bathroom and bath 	but there was a big stain on the ceiling.	The walls were thin and we could hear our neighbours television and talking during the night.	There was tea making facilities 	but no coffee or milk provided.	We did ring reception to ask for some 	but they couldn't help us.	Overall, not a friendly or helpful staff.
WHAT VALUE FOR MONEY.	Stayed at the Jolly Cavalieri for 2 nights commencing 14th November 2008.	Having read some of the reviews prior to making our choice we were a little unsure of what to expect .	Although most reviews were favourable some were not so.	However for approx £60+ per night for a twin bedded room I think you would struggle to beat the quality offerred at this price.	Having now stayed there I would happily have paid a lot more.	I can only echo the sentiments already expressed by many... excellent location... friendly staff.... walking distance to all amenities (including tower).. modern....clean...accommodating (arrived early and still able to access room).... lots of choice at breakfast.	Hotel looks like it has been newly built or recently refurbished.	We stayed on the 4th floor.	The room was adequate in size with  quality contemporary fixtures and fittings.	One helpful tip for those, who like us, have a poor sense of direction or an inability to accurately read a map...	If you intend walking to the tower (torre) turn right then right when you come out from the front of the hotel.	If like us you turn left you will turn a 30min walk into an hour!!
I stayed here for one night in June 2007 before leaving by air the next day.	Location: The hotel is located right next to the train station and bus stop that will take you directly to the airport.	There are a number of restaurants and eating facilities around the hotel.	It's a bit far from the leaning tower, 	but there's a bus stop right outside the hotel that'll take you to Piazza della Miracoli and the LEaning Tower.	It took about ten minutes and didn't cost much.	And 	even though I stayed there on a Sunday the buses ran quite frequently.Service: I traveled alone and was welcomed by a very pleasant receptionist who booked me on the second floor, close to the elevator.	If you're a woman and traveling alone it Italy it is not unusal for the hotel staff to take extra care of you and make sure you're in a room you're comfortabel with.	Room: The room wasn't all that big 	but it was more than adequate for me.	IT was modern, clean and bright with air-condtion and a tv that had a number of English-speaking channels as well as a great selection of music.	The only complaint I have is that my duvet wasn't entierly clean, 	but that was also the only thing that wasn't spotless in this room.	The view from my hotel room was nothing to write home about, my window overlooked other buildings and laundry strings full of clothes, 	but I didn't really mind...didn't spend much time in the room anyway.Breakfast: Didn't try it.I liked my stay here.	It was a hotel with a very buisniss like feel to it, so I you're looking for a charming Italian feeling hotel this might not be your place, 	but for anyone else I'd reccomend it.
The reviews I read before going varied immensely, decided to try it both forth the location  reasoable price as I was flying out early next morning.	What a suprise, Pietro at check in was extremely professional, later at the counter when he was checking in a group, handled all questions without everyone waiting in line.	This is a very contemporary hotel, that lobby  half the rooms just  were completely redone.	Hotel looks more french than Italian, right across the street from central train  bus station.	Cabs are there also  with a 5 min trip to airport which cost E7 includes cost of 2 pcs luggage.
Loved this hotel!	Had a long weekend there last week - we arrived at 10.30am and our room was all ready for us, which was a pleasant surprise.	The bed was the most comfy hotel bed I have ever experienced, and the bathroom looked like no-one had ever used it before us, it was that clean.	Also the room faced the station 	but we didn't hear a sound from outside the whole time due to the super-efficient double glazing.The buffet breakfast was lovely, lots of choice for me as I am veggie, 	but beware the scrambled egg, as it contained small bits of bacon.The staff were helpful enough, 	but we too had the problem with the key card which deactivated at least once a day, and that's the reason (as well as the scrambled egg!)	why this gets 4 stars instead of 5.
Recently returned from a stay at the cavalieri overall enjoyed our stay very handy for the railway station with good links to Florence and spent a lovely day at the coast in Viarreggio only 15 mins by train.Hotel reception staff not particularly welcoming and had a problem with keycard after each use.	No local info available at the hotel having said that leaning tower only about a 20minute walk away.Lovely buffet breakfast 	but dinner menu limited got a good deal with alpharooms £60 per night for a twin room.	Room very nice on the first floor recently refurbished spotlessly clean with lovely bathroom, would highly recommend.
Excellent hotel and excellent staff.	I'm at this hotel often the staff always treats their customers like family.	Location is perfect, in the city center, and closeness to the train station.	Plenty of restaurants in the area.	Main shopping street is right around the corner.
Excellent location.	Exceptionally clean hotel and friendly staff.	We stayed from 1.8.2015 to 5.8.2015 in room 515.	A superior room with a large bed which was comfortable.	Well stocked fridge and safe as standard in this superior room.	Breakfast very fresh and a good variety.	Efficient restaurant staff.	Would thoroughly recommend.	Only one small comment was not aware till check out of the check out tax of €16.	Maybe I missed it in the small print.
I stayed in this hotel 2 years ago with my son as we had a couple of days to kill before we were due to meet with relatives at Pisa airport.	I had chosen this hotel because it was right opposite Pisa Centrale railway station and we had decided that whilst we had time to kill we'd visit Florence.	Staying here made this so very easy, the hotel room was one of the brightest, cleanest rooms i've ever stayed in, we'd upgraded so that it would make it more of a treat and it certainly was, there wasn't anything we had to ask for, in the bathroom there was everything from body lotions to razors, my son said it was the best hotel he'd ever stayed in.	Last week myself and partner stayed here for one night only, as i was highly recommending it to him and we wanted to be close enough to the main attraction, nice restaurants and importantly again the train station.	We arrived very early, before the room was ready 	but it wasn't a problem, i was shown to a bathroom where i could change out of my travelling clothes, our luggage was safely stored and we headed out for an afternoon of sightseeing.	When we returned we headed to the room, it was so beautifully cool and air conditioned, once again there was everything we could have needed, and we will definitely stay there again.	Lovely location, lovely staff and the breakfast was excellent.
This hotel is perfectly located as a base for touring the area, close to buses, train station and taxis.	It overlooks a paved area with a fountain 	but despite the fact there are numerous people on the move the area is kept clean and tidy with benches to enjoy people watching.It is within walking distance of the Leaning Tower and the Duomo and there are good restaurants and bars close by.	There is a wide selection of shops to delight anyone who enjoys retail therapy.After a day sightseeing/touring/shopping the hotel offers well proportioned rooms with comfortable beds and pillows with crispy sheets and lots of hot water for a shower/bath.	Efficient sound proofing and air con.	There is an excellent choice  for breakfast and they will cater for special requests.	Excellent coffee!!!!	The staff are efficient and friendly all in all a great venue and value for money.
Excellent location near the railway station Pisa Centrale, within walking distance of sights, friendly staff, excellent service, cleanliness, new plumbing, air conditioning, good sound insulation, varied breakfast buffet
This hotel is opposite the railway station, 	but the area is quite pleasant compared to many station locations.	The hotel is modern, clean, comfortable and good value.	The staff are helpful and the breakfast is good, with a spacious breakfast room.	The hotel is close to Corsa Italia for shopping and not to far from the Piazza dei Miracoli for the obvious sights, maybe around 20 minutes on foot, unless you stop for a drink of course.
The hotel's location is just outside the railway station, it could be an option.My room is a standard single, quite small and definitively below any standard for a 4 star hotel.	There are numerous shortcomings, few plugs far form the bed, furniture outdated, absence of cleanness feeling, mirror absent in the bathroom.	The minibar and the breakfast prices are proportional to a 4 star, however...Reading the reviews it seems that part of the hotel has been renewed, well, it seems that I got the still-to-be-renewed part.	For the price I paid much better hotels are available.Wifi is included and of fast enough.Personnel is kind and professional.
perfect location for visiting Pisa, Florence, Lucca, Sienna and Cinque Terre.	Great rooms, friendly staff and good breakfast.	Visited this hotel now 3 times and never had a bad experience.Recommened it.
Having just got back from 3 nights in this hotel I can certainly recommend staying here!Situated directly opposite the train station and walking distance from Pisa airport, this hotel is smart, clean, contemporary and I had no problems during my stay here.The breakfast is above average, the coffee from the self service machine is excellent... this coming from a bit of a coffee snob too!
You can get off the train in Pisa and walk a reasonably short distance to the hotel - having cases with wheels would be helpful if they were heavy 	though.	Room was very nice and so was the included breakfast.	Room was modern, clean and comfortable.	Plenty of choice with breakfast.	Hotel was well priced too and 	though we chose it for its proximity to the train station and the fact we were there only one night, we would have happily stayed there for longer if needs be.
Arrived from Pisa Airport to take a quick tour of the Pisa sights.	Fantastic location opposite the train station, 4 star hotel, clean, organised, comfortableand reasonably priced.	Situated about 15 mins from the Leaning Tower, Cathedral etc giving a pleasant walk through the main shopping area and over the river
I stayed in this hotel several times from July and September as a major airline crew member.	The rooms very always ready at the time of check-in which is a big plus 	although if you request a room facing the train station they always make you wait for a while before it's ready.	The corner rooms are very small and dark.	Giuliana and Laura are the only friendly receptionists and they are very helpful and professional.	They were always smiling and greeting me.	Five stars to them.
