The premises are very peaceful and well maintained.	The apartment was spacious 	though basically equipped.	We enjoyed the fine pool and good food.	But the hospitality was overwhelming!	These people are so friendly and helpful that you'd never want to leave again.	After a small accident with a child that needed stitching in the hospital the brought us there and picked us up again and arranged some snacks during the waiting.	Arriving back at the hotel after midnight we found the complete staff waiting to welcome us and then preparing dinner.	Really a moment never to forget
5 min drive out of Pisa or you need to catch the Bus, too far to walk.Beautiful self-contained apartments, well appointed with plenty of space, very clean.Great pool area with spa and massage area downstairs.
My family of 5 stayed at the residence San Rossore for 8 nights.	We had a great time mainly due to the pool, friendliness of the staff, and a good base for exploring.	(The attractions in Pisa, Lucca, Florence, and the Beach)The villas are huge and very functional which is a key requirement for a young family.	The kitchen mainly comprises of a hob and a fridge so is fairly basic.	We tendered to eat out most nights so this wasn't a problem 	but when staying in had no problem with cooking pasta from the local 'deli'.	The apartment only has Italian TV therefore those travelling with kids may wish to bring a Dvd player or laptop for their evening entertainment.	The Italian breakfast served in the bar area was a tasty and leisurely start to each day.
We stayed here for a couple of nights on the way down to Tuscany  needed somewhere that was clean  had a pool.There seem to be very few hotels in or around Pisa that have pools  are reasonably priced.	This fits both bills.	The apartment was clean, and there was a bar in the hotel itself to get drinks, snacks  a well priced breakfast at 5 euros per person (croissant, coffee, juice  cereal).It had wi-fi which was 5 euro per 24 hours.It also had parking  was well situated to visit Pisa  the coast.All in all, it was basic, 	but perfect for an overnight stay.
The accomodation was simple 	but more than adequate.	Spotlessly clean and very spacious.	pool area was very pleasant - the highlight was the level of service.	Thanks to Petra for sorting out a mix-up with the booking and letting us check out in the afternoon on the day we left.	Great ceentre for exploring Pisa and the surrounding areas.
We booked this accomodation with a group of six people for our stay in Pisa during a conference.	Although the accomodation was quite far from the city centre and the conference center, it was easy to get there by bus (only 1 euro) or taxi.	Petra was quite happy to help you arrange a taxi or provide you with any tourist information.	She was very friendly and helpful, always smiling and really gave us a pleasant and welcome stay at the residence.	We enjoyed having to opportunity to have a quick dive in the swimming pool at the end of our day before going out for dinner.	The appartment was clean and spacious.	As we did not have a car, the supermarket was quite a bit of a walk.
The Hostel is in a pretty good location, about a 15 min walk from the airport and the directions were pretty good.	and then about a 10 min walk to the Tower and only a 2 min walk to the train station.	The Room wasnt the best, we stayed in a female dorm on the ground floor and didn't seem very secure, the room door didn't have a lock and the front door of the hostel was open all the time.	The room had a locker for everyone, however the one we were allocated didnt lock.	Not the cleanist place, I got bed bugs here.	The bathrooms werent the best either, there was 2 dorms on the ground floor and only 2 bathrooms.	There was no water pressure at all, had to have a cold shower.
While travelling around, I spend one night in Station Pisa hostel with 3 friends.The 4-bed room we had booked was clean 	but really simple and the beds were 2 bunkbeds, no problem for us 	but might be a problem for other age groups.	The bathroom was shared with another room 	but clean as well.	It's location is perfect, between the airport and the centre, on the other hand Pisa is a rather small city, so everything is in walking distance.	As far as I saw, most people in the hostel were young travellers, which is also the age group I would recommend this hostel to.	The receptionists were nice and helpful with everything we needed.	For the price of 50 euro/night for a room for 4 people, it was more than expected.	However, I wouldn't recommend it for people who want to travel with luxury, just for the ones who need a simple, cheap, clean and convieniently located place to stay.
the place is clean and the staff friendly 	but three big minus: 1. they charge us (3 persons) ten euros meanwhile other guests in the dorm told us that they paid seven euros 2. and it was too hot so we hard couldn't sleep.	Imagine how it is in the summer!	The ventilation is bad.3.	we couldn't sleep neither 'cause there's a highway right next to the hostel so we heard all night all traffic rush by ;-((
I just love this place - not only because of charming &quot;Adonis&quot; Carlo and funny &quot;Entertainer&quot; Giovanni and their honest advice &quot;make it your home!&quot; It definitely felt like home, cause the atmosphere was relaxed and personal and from the beginning the guys carried over the italian way of life.	The rooms are basic 	but totally cosy and clean and  the free espresso is just superb, especially when Carlo is preparing it with lots of love.	;))) The hostel is about 5 minutes to town and in case it rains while you stay there - just ask Giovanni to order the best pizza in town and enjoy it with a glass of good italian vino, because sharing is a matter of course with these great hosts.	I`ll come again and not only because of Pisa - 	but because of two guys, who love what they do and deserve success and happiness.	THANKS guys!
My friend and I went to Psa just to hang out and take pics of the Tower and go to other cities in Rome.	We had no clue about hwere to stay.	We stumbled on Hostel Station at the recommendation of a person we met in a restaurant.	I have stayed in Hostels before; some are nice 	but others can be really bad.	This one was WONDERFUL!	The staff were so accommodating and fun.	They laughed with us and met our every need!	The rooms were clean and nicely decorated.	The location was great; a five minute walk to/from the train station, five minute cab from the airport, five/ten minute cab from the Tower.	There are even bikes to use if you want to pedal around the city!	I would recommend this Hostel for young travellers as most of the residents were in their 20's.	The Hostel Station was a perfect solution and we even stayed two nights after having so much fun there the first night.
Wanted to stay in the hostel for two nights together with some friends.	I have stayed in many hostels before 	but this was the worst ever.	When I woke up I saw bed bugs on my bed.	Stitches on my whole body.	It was so itchy!	Please do not stay in this hostel to avoid spreading those bed bugs to other hostels or your home!	The bathroom was old, the shower was cold and unhygienic.	I stayed there in octobre and there were some strange people in the hostel who were definitely no backpackers or tourists.	It was very loud at night because of the railway tracks behind the hostel and the motorway.	I liked the free wifi and the dinner 	though.	The location  was okay: close to the airport and station 	but a little far from the city centre (~35 min walk).	nevertheless: absolutely disgusting!
Difficult access to the center by public transport.	The same applies travel to/from the airport between 22.00 and 6.00am.	Internet only in lobby, which is not good in the hotel who watch the standards.Very good breakfast.	Possibility of receiving snacks from 4:00 AM, which does not happen in other hotels.
Somewhat hidden away on the first floor of a 19th century building, 	but only 5-10 minutes stroll away from the Tower and Duomo, this lovely family run hotel is very welcoming and a great base for exploring Pisa and other nearby towns e.g.	Lucca is only about 30 mins by train.	Great to wake up to frescoes on the ceiling!No meals are served 	but the Filter cafe across the road serves fantastic food and gives a discount to Galileo guests.	Free wifi.
The stayed late to welcome us.	Taxi mix up took us to the Hotel Galelei - which is a very different place.Simple rooms on the second floor or and old town house - much like other places we stayed in Italy.	Not the most modern - 	but if we wanted that we'd go stay at a Marriott.	Rooms were clean and reasonably sized.One small peeve was the towels which were more like dishcloths - did the job ok 	but no fluffy.	Handy for walking to the tower etc.Was fine for a single night which was all we needed in Pisa.
I stayed at Galileo for one night.	I dont really know how they got 4 stars.	The photos dont show the reality: is a first floor of a old building, bad decorated.	You can hear everthing from other rooms, or in my case, from my room, i would wake up everytime someone would enter the hotel.	And for me the worst point is definitely the lack of cleaness, cause I think is totaly unacceptable to pay the price you pay and notice that the floor, the bath arent clean.For being fair, i would have to say that the girl at the reception desk was nice and kind, and that was the only positive thing.
Spent two nights over Easter.	Francesca gave us all the information we needed, from best time to do the tower, to where the best bars for happy hour were!	Rooms are beautifully decorated, flat screen tv, fridge and lovely newly decorated bathroom.	The only issue was with our room being next to reception, we could hear people coming and going late at night and early morning.	However, still very good value.
This is a very good hotel to stay in at Pisa.	The location is fantastic - it is about 500 m to the Square of Miracles, easy walking distance.	The staff were amazing - full credit to Francesca for friendliness and helpfulness.	The rooms were clean, tidy and comfortable, of decent size, as well as the bathroom.	The only downside was that my room faced onto the street, and late night partyers/ early morning traffic did wake me up, so sleep quality wasn't the best.	I do recommend this hotel 	though, it is a very, very good stay.
This hotel is in a great location, very central.	We were staying just one day in Pisa and we easily walked the city from here.	The rooms are basic 	but charming with an old world pretty style.	Dont miss the ceilings!	The bed was really comfortable.	The staff were really friendly and very helpful, I absolutely recommend this hotel if you are going to Pisa.
The hotel offered Great service, excellent  hospitality and nice, clean rooms!	The style was completely medieval and puts you in the Toscany mood.The location of the place is totally central- a few blocks from piazza dei milacoli!
A very basic room 	but for the price it was really good.	Very clean and really friendly staff.Shared bathroom down the corridor which would not suit some people 	but was very clean.Our room overlooked a side alley which was very noisey during the night as well.Excellent location for the Tower and Cathedral however as well as the area for the bars, restaurants etc.20 minutes walk from the train station to avoid waiting in the Taxi rank.Reception closes at 8pm so you will get a key to the front gates and a key to the front door, as well as a key to the room and a key to the bathroom.
At first we thought we were going to have a bad stay: either I booked by mistake a room stating it was for 1 or there was an issue with the system.	The lady told us we had to pay extra.That said, when I should her that the room costed the same whether for 1 or for 2 people when booked online, she called someone and everything was fixed.The room was really nice.	The bathroom, private, was outside the room.	I enjoyed that a lot as given the space constraints, it gave privacy as well as kept the moisture from the shower out of the room.The location is awesome.	Half way between the Tower of Pisa and the downtown area.Fantastic value!
The hotel was helpful in giving me instructions to access 	but note they do not have a front desk past 8pm which was a bit odd.	I couldn't get the wifi password to work.	The hotel room was very clean and huge.	My double bed was two single beds put together, a bit weird.	The shower was ok and bathroom was clean.	The trouble was the mosquitoes.	I literally couldn't sleep as they kept buzzing in my ear.	They are everywhere and the visitors book included people mentioning this.	Not sure there's much they can do about it 	but it ruined my stay and left me very tired and bitten the next day.	Certainly would not stay again for this one, very important reason.
This hotel is what you would expect of a typical Italian home in the city .	The room was large and the furniture was rustic which is why I chose this particular hotel .	Rooms were clean.	Easy access from the airport , we arrived late so the bus only went to the train station 	but it was only a short walk of perhaps 15 minutes to the hotel from here .	The leaning tower was a short walk from the hotel as were a good choice of restaurants .
This is the perfect hotel for a stay in Pisa.	The rooms are quite basic 	but the feel of the hotel is really nice and the staff go out of their way to make you feel welcome.	We arrived early 	but they let us into the room anyway, which was a great help as we had heavy suitcases.The hotel was in the next street to a vegan takeaway place (perfect for us), and only a short walk from both the Tower and the river.There are probably more luxury hotels out there 	but this was nice and cheap, and the staff really couldn't have done more to make us feel at home.
I was so surpised by how nice hotel was.	It was amazing!	Very clean, toilets are modern and clean, staff was very very helpful and friendly!	Very close to pisa tower and all the surroundings (5 min walk) and only 15 min walk away from Pisa Centrale station which can take you to many other cities (very reliable).	A true gem!
If you want a hidden gem ...you just found it!	Francesca and her family will reward you for staying with them by treating you with warmth and generosity ....if you are after a relaxing simple and beautiful stay..this could not be more highly recommended!Ps the family have become lifelong friends :)
We changed our minds at the last minute and decided to spend a little more money on a hotel more centrally located, this turned out to be a great decision.	This hotel is still very reasonable considering its location and rooms.	We stayed only one night, arrived very hot and bothered, 	but the hotel was a breath of fresh air.	Our room was spacious and beautiful - the fresco on the ceiling was amazing and there was a lot of space for a city centre hotel.	There was no air con in the room which was a minus point, 	but after a short game of charades with reception they produced a big fan for us pronto which was perfect.	No breakfast, 	but they give you a voucher for a cafe across the street where you can get breakfast for 2.50 if you so desire.	Tip: there is an AMAZING little snack spot if you come out of the hotel, turn right, and head about 150-200 to a small square.	It's straight ahead of you, blackboards outside advertising sandwiches.	Go in and pick one-  great selection of lovely meats and you can also help yourself to some local wine.
Had a great stay here and everything was marvelous!	From the hosts (Francesca) to the beautifully large rooms!	Great location near to train station, the leaning tower and the old part of the city!	I would recommend this to everyone...Pisa is great!
For us Hotel Galileo was in a perfect location, close to the old city centre and 5 – 10 mins walk to the Leaning Tower.	There were lots of cafes, gelaterias and restaurants nearby.	We had booked the triple room and the room was very spacious.	Everything was clean and the beds were very comfortable.	The room had character and high ceilings, however,  the walls were a bit bare and some pictures would have been nice.	The bathroom was also clean, seemed to have fairly new fittings, and the shower worked perfectly.	Some minor criticism:  towels were a bit strange; the face towels were like napkins and very hard.	Also, the room was right next to reception, so you could hear everything that was happening there and was a bit noisy on the first night.	Francesca at reception spoke very good English and was really helpful, giving us tips about where to go and what to see in Pisa.	There’s no breakfast at the hotel, 	but they have an arrangement with a cafe down the road where you can get Italian breakfast for €2.50.We were very happy and recommend this accommodation.	The price was €75 per night which I thought was good value for a triple room in such a central location.	It’s not luxurious 	but had everything we needed.
This was a good hotel because of its location,  it was near the Arno River and we were in Pisa to see the Luminaria.	However it was five to ten minutes away by taxi from the Pisa Centrale.	On arrival we were surprised that it had no lift so you would need to bring up you luggage up three flights of stairs.	The rooms were not airconditioned 	but because it had high ceilings it was still comfortable.	Please make sure to bring insect repellants if you want to be able to open the window.	The ladies in the front desk were very helpful and friendly.	We would probably stay here again 	although maybe not during summer.
This is the second time I have stayed here as an overnight after arriving at the airport at the start of a holiday.	The taxi fare is steep at 10-15 euros 	but really there is not an easy way to get there otherwise.	The hotel is impersonal 	but clean and offers a very good choice at breakfast: it is an eat all you can and stoke up for the day ahead type of breakfast.	There is a noisy road outside so it depends on which side of the hotel your room is to how this may affect you.	It is very possible to walk to the centre of Pisa in about 20-30 mins.	There is a dual carriageway outside and the pavements is not continuous on both sides so you will need to cross.	I noticed a small supermarket had opened on the route in to town since my last visit so one could buy food for a picnic perhaps.	Would go there again in the same situation as a woman travelling alone.
I am very comfortable with the daily.	It is a very well maintained hotel.	All clean.The staff is very friendly.Metro is just around the corner.	Very central.	The hotel manager Mohamed is very nice and gave us the feeling to be given at home.	Thank you for all.	I come back.	This hotel is very recommendable.	The Rooms and the Bathroom is very clean and very nice.	all excellent;)
Very close to the old town near the tower and church.	Also, easy access anywhere, via bus stop outside hotel.	ticket to central train station can be bought from the tabbaccini across the road.lots of eating places.	lots to see.	Staff was very accommodating, especially Francesca, - Any request made was quickley seen to.
I can highly recommend this hotel.	Although one shouldn't expect a luxury entrance or other star-hotel-stuff, it was our top choice during our trip in Italy (including another hotel in Pisa).	The owner (and her parents) made us feel very welcome.	The rooms (and common areas) are very large and have a personal touch.	They are modern, have decent beds and a good bathroom.	Excellent value for money.
Amazing location, only 5 mins walk to the Tower of Pisa and train station.	Wonderful service with a lovely and caring host &quot;Francesca&quot;.	Very spacious room with clean environment.	Will definitely recommend to my friends with real affordable price.	If I'm back to pisa again will be sure staying here again.	Regards from Ireland.
excellent value for money.	very close to main attractions and on bus route to station and airport.	very clean with lovely staff.	breakfast-fresh croissant, juice and coffee taken in pleasant cafe downstairs.	highly recommended budget hotel.	basic 	but classy
we aririved pisa and got alittle shock from the whole hotles and bb, everything was very croudy and not friendly at all... We were on our way out of this city and then we found this lovely bb.	It has the best location, very cloose (5 min walk) to the leaning tower.	Very nice people, very big rooms, very very clean.	It is highly recomended.
Came here to have lunch with colleagues and it was very nice.	We went to the backyard, menu was good, varied, food presentation was clean, excellent, delicious and prices are average.	Will come back for sure.
After having completely mixed up online booking of hotel in Pisa  for one night before going back to London,  I walked around  and found this nice hotel just 50 meters from the train station after arriving from Florence by train!	It has very spacious room for family of 4 (it even had one more extra bed).	The bathroom 	though was a bit down for the overall experience, not dirty 	but needed a bit shining.The breakfast was very simple, 	but for one night it was OK.The location is just perfect when traveling by train (1min walking around the corner).The taxi stop is at the train station (1 min walking) and the taxi takes about 5 minutes to Galileo Galilei International Airport.Would definitely consider staying there again if traveling through Pisa.Very friendly and helpful staff.
I have found that most hotels in Italy are tiny.	But my husband,  2 children  I were very pleased with the size the room here.	It is almost across the street from the train station were for about 10 euro you can catch a train to Florence (under an hour) You can also spend a euro or two and hop on a bus that will take you all over Pisa.	not only will i recommend the Roseto to my  friends  family, It is were I will be staying whenever In Pisa.
We spent our last night of a 2 week Tuscan trip in Pisa so that we would be close to the train station on arrival and when we wanted to leave early to catch a taxi to the aeroporto for the flight home.	The room itself was OK, 	though they failed to tell us how to turn the lights on in our room (it had the key card in the slot thing) so we had to go back downstairs to find out.	Communication was definitely as issue at this hotel, since the desk clerk spoke just enough English to make us think he understood what we were saying, 	but I don't think so half the time.	The shower was SMALL, and I've seen some small ones in Europe, usually with no complaints.	Pisa itself was disappointing after Florence, Cortona, Siena, Vernazza, and Lucca.	We did get some cool David refrigerator magnets for our girls at the Leaning Tower however.	The biggest problem we had was that 	even though we told the desk clerk at least 3 times that we were leaving at 6:30 am for the airport, we found the front gate locked as we tried to leave the next morning.	I walked back to the apartment where the clerk was pulling on his pants to come out.	He was agitated that we wanted to leave before they open the gates at 7:00 am.	Well, he opened up and we are back home and that is just another story to tell.	Why would you have a hotel next to a train station and near the airport that you can't leave before 7 in the morning?	Beware.
We stayed at the hotel on New Year's Eve as hotels in Florence and Rome were tight.	The location is convenient for those arriving by train, 	but about 20-min walk from the historical centre.	The area around the train station also tends to have more budget eating options that open longer hours, as compared to the town centre.We paid 72 Euro for a basic, tiny room with toilet.	The place is all right, being rather clean with a springy bed and a small tv (with all Italian channels).	Because of the tiny room size we could only walk the narrow path around the bed.The bathroom is very new and the nicest part of the room.	However the floor gets wet easily due to poor shower partition, and the lack of a curb at the entrance means the room also tends to get pretty wet too.The room rate also doesn't come with breakfast, which is charged at 5 Euro per person.	The staffs are also pretty hands-off, meaning they will advise if asked 	but otherwise will not engage guests.	They close the hotel at 1am, 	but will give you the key to the front door if asked.Overall it's all right place to crash for a night, 	but the very bare rooms will not impress.
Very noisy at night.	Beds are very small - I'm 5'6&quot; and my feet were hanging out of the end!	The walls were like paper so you can feel very intimate with your neighbours.	Shower is poor.	Convenient location 	though.	We wouldn't stay again.
• The staff was extremely helpful and friendl !	• The rooms were not modern 	but were very clean.	• The area isn't much pleasant 	but it's great to be so close to the train station (right next to it actually).
