It is 1 min walk from the hotel to the train station, breakfast is exceptionally good, freshly baked pastries, very tasty and delicious!	Helpful staff.	Room is comfortable.	Highly recommended to visitors to Pisa.
The location is really good and the hotels environment is really clean and nice, and the people there are very warm and nice.	The only disadvantage is that the facilities in the bathroom is a little bit old and broken.
Well situated hotel right opposite  main railway station with regular trains to Florence and Lucca,both of which we visited and thoroughly enjoyed.Bus from and to Airport,10 minutes if that away,stopped right outside the hotel both ways.Arrived well before check in time 	but in room within minutes.Very friendly and helpful staff at reception.Room very satisfactory(312) with good bath/shower,fridge,TV and free wifi throughout hotel.Basic buffet breakfast 	but reasonable choices except not much in the way of hot food 	but enough for us to enjoy.No other dining options 	but not far to go to find some reasonable eating places in the evening.We walked slowly to the obvious attractions passing shops on the way and arrived within 30 minutes or less.So would be happy to recommend here and would definitely use again if we go back to Pisa
We stayed here for two nights and I would highly recommend!	The overall location of the hotel is perfect.	The Leaning Tower of Pisa is a quick walk, you are literally across from the Pisa Centrale Station, and the taxi and bus service is right out front.	We were nervous about finding the hotel from Pisa Airport 	but we were delighted to find out the Taxi service had a fixed rate of 9 Euros to the hotel.	The hotel was very clean and well maintained.	There were no interruptions in service from the moment we arrived to the moment we checked out!
A little quirky finding it, 	but a good experience for sisghtseeing.	There were over 20 of us checking in for an overnight stay.	The check in process was rather smooth, 	but the elevators could only handle three people and luggage at at time.	Kinda frustrating after a day's travel getting there.	The room was small and practical.	The breakfast provided something for everyone from he buffet to fresh cooked items.
Stayed a night at this hotel a week ago, flew from Gatwick, for  a week in Italy, this Hotel is in a very good location, right opposite to Pisa train station, city shopping centre is just 5 minutes by walk, bus stop at the Hotel takes you to the famous Pisa leaning Tower.	This hotel offers free WIFI;  Next day took a train to Florence for two nights.	read my review for Hotel C-Hotels Diplomat for more Info.
I recently stayed a night at this NH hotel.	The location is perfect if you have an early flight, train, or simply plan to spend a few days in this wonderful city.	I was initially assigned a room in the 2nd floor that was not renovated.	The carpets were stained and the walls were not in the condition that one would expect for a hotel of this category.	After a quick call to the front desk I was reassigned to a room in the same floor 	but in the opposite wing.	Floor were all wood, bathroom floors, counter tops were in marble, and the decor was pristine.	Customer service was top notch.	Breakfast was included 	but since I had an early train I was not able to enjoy it.The hotel is a quick 15 minute walk to the tower, there are restaurants, cafes, a gym, and a supermarkets nearby.	Because of its closeness  to the train station, there are characters roaming around 	but I would NOT characterize the area as unsafe.	I definitively enjoyed my stay in Pisa.
The nh Hotel in Pisa has the friendliest staff you could ever come across in a hotel.	Always smiling.	Always friendly.Always helpful.	From the room maid to the kitchen to the front desk.	Wonderful!	And being located straight across from the train station and 10 minutes from the airport makes for a good base to visit Tuscany.	No noise from outside was very surprising.	Wish it had a bar.
Nice hotel, right opposite the rail station in central Pisa.	Its a lovely 30 minute walk to the tower through picturesque Italian Streets.	Friendly, helpful staff who spoke good English.	Nice, well appointed rooms with comfortable bed.
This comfortable hotel is situated about 100m from Pisa Centrali rail station.	Pisa is a rail hub where you can easily travel to Livorno, Lucca, Florence, Cinque Terra and Rio Maggiori.	A great way to see the local sights.PROSVery convenient to Pisa rain station.	Clean, comfortable, very good buffet breakfast and good internet.	English speaking front desk.	Off-site parking is around the corner 	but expensive.	We were able to walk to all the sightseeing locations.CONSAs usual with a railway station location the general surroundings could be better.	Having said that, the area is not unsafe.	We think the location to the station trumps the surroundings.
Hotel was excellent with a fantastic location very close to railway station buses and taxis... cleanliness was impressive the only drawback was no restaurant in the evening...it was my second stay there and would not hesitate to go back!
Stayed here just for one night to ease our return to UK to avoid a very early start from Florence.	We couldn't believe the value we got having booked through expedia - £75 per couple including breakfast!	It's 5-10 mins by taxi to the airport which could also be walked in 15 minutes.	The hotel must have been recently refurbished in modern and contemporary style with large open public areas.	The rooms are not especially large 	but are designed well and very comfortable and include tea/coffee making facility and ours had a small balcony overlooking the piazza in front of the main Pisa train station.	Despite it's central location there was no obvious noise.	The staff were brilliant from arrival and a special mention for Nicola (a guy on reception) who was just brilliant who also pointed us in the direction of a great restaurant 2mins from the hotel - Lo Schiaccianoci.	The hotel is not set in the tourist area 	but it is only a pleasant 15 minute walk to the main tourist interests.	We don't think you can go wrong booking this hotel at the price we did - great value.
I didn't arrive by train 	but for anyone traveling by train to Pisa this is the ideal choice.	Across the Street...	It's also withing walking distance to the heart of Pisa and the Leaning Tower.	I arrived late and still had time to walk around and do some sight seeing.	The Room was incredible and to wifi was very good too.
A comfortable modern hotel well located for travellers and visitors.	Two minutes walk from station, about 8-10 to the edge of the old town, and 15-20 minutes to the Duomo, Tower and Campo Santo.	The building and interior are functional, clean and well maintained.	We had a room on the 4th floor overlooking the busy station 	but with effective triple glazed windows we could hear no external noise.	Room was compact 	but not cramped, with some stylish attention to detail in the placing of lights, mirrors etc.	Bathroom had both shower and tub.	Breakfast was fine.	We got friendly and helpful service from the staff at check in and check out.	If you set your expectations realistically (i.e.	are not looking for luxury or period character 	but want something significantly better than basic budget accommodation) then this fits the bill.	We thought it was reasonable value and would stay there again.
Lovely town.	Very friendly and relaxing.	Easy to travel to Pisa and much cheapier than for example Firenze and Rome.	The area around the leaning tower and churches and tombs were fantastic, so clean and not that crowdy as i thought before.
Excellent hotel, perfectly situated for our needs, being opposite the main line station, and was in walking distance of a variety of good eateries.	Fabulous staff, friendly, helpful, polite.	Our room was absolutely amazing!!!	lovely view.	Free Wi-Fi.	I would like to say a special thanks to the reception staff who were brilliant a special thanks to Enrico who is best receptionist .Recommend this hotel 100% and would love to return again.
Excellent place, amazing spot unique service , just next to the train station and really near everything,clean place and great price,Pisa tower and all the hot spot places are very close you will be very satisfied as we were...
On our way back from Florence we decided to stay a night and pick up a flight next day, this hotel was perfect.	It is located opposite Pisa Centrale station so not far to lug the cases, it is quite modern internally with modern finishes etc.	The room was equipped with a king size bed and TV, the on suite has a bi fold screen to flush floor mounted shower, a colosses of a wash hand basin with the toilet of a height that you felt like a small child as your feet did not touch the floor.	We could not find fault with the room which overlooked the station frontage from the first floor.Breakfast was traditional continental or as we had fresh fruit, cereal and toast, coffee was machine ground coffe and quite palitable.The main moan is again the City tax of 2 euro each per night, what did I get for this was a question no one answered.
Name of the hotel is actually NH Cavalieri, not NH Pisa.	Anyway, the hotel is a good NH hotel and was improved a few years ago.	Now all rooms have good aircondition and are modern.	Some of the rooms are very small, 	but other than that a good hotel.	Typical NH breakfast which is good and better than many other smaller italian hotels.	Stayed at the hotel 6-8 times on business and i always use this hotel when i am in Pisa.	Hotel is located in downtown and there is like 20 min walk to the tower.	Located 100 meter from the railway station in Pisa.
This hotel looks a very good quality building however the checkin was awful as it took a long time with someone who could not speak English which is weird as they consider the hotel to be of international standard and I wanted to ask questions 	but could not.We chose the hotel as we wanted to eat dinner there -- I have cut and pasted the following from their website&quot;The Ristorante dei Cavalieri is an excellent spot to sample some of Tuscany’s tastiest dishes.&quot;Ooohhh to have had the chance 	but the restaurant remained stubbornly closed.We had an upmarket room and had a tea/coffee tray 	but they did not supply milk.The breakfasts were nice and as we travelled by train the location opposite was great.	-- It seemed all buses including the hop-on hop-off tour bus also stopped outside so it was in an excellent location 	but we did however struggle to locate restaurants in an easy walking distance as all we could find was just one which was quite expensive.
Wonderful location for busses, trains, local shops and restaurants.Modern, spotlessly clean rooms with excellent beds and pillows.	While in a busy area there is very effective sound proofing with no traffic noise to disturb.Did not have breakfast as we preferred to stroll to a local cafe so while we can not speak for the food we can say that the dining area looked bright and inviting.
We only stayed here for one night because our flight left from Pisa, 	but we had a very pleasant experience.	The staff (Nicola who welcomed us at the reception in particular) was very kind and helpful.	Our room was ready before the agreed time.	I liked that a 2 person room has 2 single beds on wheels which can be put together or separate.	Bathroom and breakfast were excellent.	The only downside was that the rooms are not soundproof.	I don't mind hearing muffled conversations at all, 	but it got annoying when I could here my 'neigbour' snore.	Other than that everything was awesome.
Excellent location opposite station and around the corner to the main street.	Very good clean and modern hotel with good hot and cold breakfast.	Ask for renovated rooms or complimentary upgrade.	They will try to help.	Well appointed rooms, good wifi and parking.	Minor considerations were it didn't have its own restaurant for dinner 	but they recommended a very good one 5 minutes away.	Could do with more coffee in the room.	Staff very helpful and we had an excellent stay.	Would definitely stay here again.
The room was very clean and the bed comfortable.	If you are in a single room, it may could be small for you - 	but it's large enough to sleep.	The hotel is just opposite the main station and within 30 minutes walking distance from all major attractions.	The breakfast was very delicious with rice milk, regular milk, fresh fruits, eggs, and much more.
The NH Pisa is a modern hotel located directly across the road from Pisa Centrale Railway Station, so is ideally situated for day trips by train 	though the down side to this is that it is a fair 20-30 minute walk to Pisa's main attraction, the Leaning Tower, Duomo and Baptistry.	Despite its location, there is good sound proofing and there was little or no disturbance from traffic, either on the road outside or from the nearby railway.For our week long stay, we had an upgraded room with balcony on the fifth floor and the room itself was well presented and clean 	though the fact that it has a balcony means that it is smaller than comparable rooms on the floors below.	Some may find it a bit cramped 	but was more than adequate for our needs.There is a breakfast room on the ground floor which was big enough for most guests to be accomodated.	Only on one occasion did be have to wait a few minutes while staff cleared tables.Breakfast itself was the usual self-service continental style with a small hot selection (scrambled eggs and bacon) and a good selection of breads, cheese, meats, yoghurts and fruit which was regularly replenished.Front desk staff were pleasant and efficient during both the check-in and check-out process whilst staff in the Breakfast Room were also pleasant and friendly.The only downside was that the air con in our room produced a musty smell.	However, with the balcony, it was possible to open the doors wide to allow air to circulate and we don't normally sleep with the air con on in any case, so this was not an issue for us.We would have no hesitation in staying at the NH Pisa on our next visit to the city, nor indeed recommending it to visitors.
Modern, spotlessly clean and excellent location opposite Pisa central station.	The room was very nice with a good powerful shower.	The staff were very friendly and helpful.	Nice breakfast with a good choice.
Picked this hotel for location opposite Pisa Centrale station so great base for train journeys to Florence, Lucca, La Spezia.	Modern hotel, nice big room, very quiet 	even though facing station (rm 407) due to secondary glazing so slept well.	Very comfy beds, good hot shower.	Plenty to eat in buffet breakfast , 	though sometimes queue for coffee machine.	Friendly staff.	Only issue we encountered was no chest of drawers to put our clothes in.	2 small drawers in wardrobe of which one side blocked by large desk so we had to keep our clothes in cases.	Room must have been designed for a man for a male staying one night!	Please sort for future guests!	Despite this, I would definitely stay again.
Stayed there for one night and this is not our first visit so we were very disappointed when we received a sub standard room (104) this room had obviously not been renovated - 	though the hotel advertises safes in every room there was none in this room and the rooms you see on the web are not like this.	Very old TV - air con unit falling to bits, carpet and deco shabby, bathroom needing up graded.. there was dust under the mini bar  in the room looks like not been touched for ages.. We have stayed here before and had the renovated rooms which are really lovely and did not realise that some rooms still required to be upgraded so would think twice about staying again.	Just a shame.. there is also no bar area in the hotel where you can have a drink before going out for dinner or on your return..
This Hotel is opposite Pisa Central rail station and a 10 minute stroll to the popular leaning tower.	Our room was slightly worse for wear with flaking plaster 	but we were well rested in the comfy bed with full air conditioning.	Wi-fi connection was disappointing as the signal was week, hotel claimed to provide 256kbs and we could only get 68kbs (free for the first 24 hours).	Breakfast had a good selection of pastries, cereals, and hot food with good coffee.	I would recommend this hotel if you don't rely on the Internet.
A very pleasant stay.	The only negative is that it is so near the railway and bus station that seems to encourage many street sellers onto the pavement outside the hotel and along the street beside the hotel going to the city.	The hotel, itself is newly renovated and the rooms are crisp and clean.	Even though we had a room overlooking the busy station plaza it was very quiet due to the triple glazed window system.	The staff were helpful and the included breakfast adequate.
An easy place to stay for a night in Pisa.	If, like us, you arrive at Pisa via the Central Train Station (which serves the airport and Florence), this is a good choice for a comfortable night's stay.	It's directly opposite the station, 10 mins walk to town centre and 20 mins to the Leaning Tower.	Breakfast was decent and overall a reasonable value hotel.	Don't expect luxury however: no in-room tea/coffee (just a free machine with plastic cups in lobby), the &quot;double&quot; room was really a twin, checkout slow and not many amenities.
Just across the street from the railway station, it could not be located better.	The walk to the leaning tower is about 20 min and there are several little restaurants less than 5 min away.While comfortable the room was a bit small, 	but sufficient.	Great breakfast.
My sister and I arrived in Pisa train station tired and weary after a rather long train journey from Venice en route to Cinque Terra.	What a relief as we emerged from the station to see our hotel directly across from us like a welcoming friend.	We requested a twin room 	but were allocated a beautiful family room overlooking the square.	The room was  quiet due to the very effective double glazing.	We loved everything about this hotel, the staff, the room and particularly the delicious healthy breakfast.	The very helpful lady on reception recommended a really lovely restaurant close by for dinner the night we arrived.	Unfortunately we only had one day to explore this lovely city 	but I plan to return again soon.	Hopefully next time I can fit in a spot of shopping as the shops looked very inviting as we passed on our way to The Leaning Tower.
Location is perfect for airport and railway station and it is a pleasant 20 minute walk to campo miracle.	But this side of town is nice too.	I was just a bit disappointed because of a few issues.	Firstly the rooms are pretty small 	although they are nice and modern and the bathroom is good.	Secondly, they only left one towel in the room.	I hate this practice.	Maybe they do get a lot of business customers who only need one towel 	but why should couples on holiday have to go to the trouble of phoning housekeeping and then being kept waiting for over 20 minutes to receive one more towel???	We still only ended up with 2 large and 1 small.	And thirdly, another pet hate - no milk to go with the teas and coffees in the room.	There is no point providing half the kit for a cup of tea!	I had to go down to reception and use a coffee machine to get some milk.	These are all small issues 	but when you are paying £112 a night you shouldn't have these little niggles.
Don't get a standard room here, get a superior room.	The rooms here are drastically different, the newer superior room was quite nice, newly remodeled with a huge rainfall shower.	The standard rooms on the other hand simply don't cut it, old and tired.	Breakfast was decent and wifi free.
We stayed here for 3 nights very clean ,great location right by the main station where we took the train to Florence and Lucca  very easy to use and cheap and all on time too, Hotel is only about 15 mins walk from Tower etc  with lots of shops to look at on the way .We took a Taxi from airport for 10 euros  	but you can take the train or bus too ..Overall great trip if or went we went back we would stay here again .
We stayed here for one night whilst on our way to Florence.	The location is superb right outside the train station, a large multi story car park a few minutes walk away and a half an hour walk to the leaning tour.	The room was clean, nice big bed, my boyfriend enjoyed the huge waterfall shower whilst I liked the big bath tub.	Breakfast was great, plenty of choice hot and cold buffet, gluten free bread was available.
Hotel was brilliantly situated for the train station which made travel to Lucca, Siena and Florence all very easy.	When we arrived, it was after midnight and the first room we were allocated on the 5th floor was very unappealing - stank of smoke and was very dated.	As we were using the hotel as a base for 5 nights, we asked to be moved and the room on the 3rd floor was worlds apart - very clean, modern and most importantly, no smell of stale cigarettes.	Breakfast was standard.	The room had a safe, a fridge and very crisp clean bed linen / towels and basic toiletries were provided.	The only real improvements needed are 1) long life milk in the room to make coffee / tea and 2) reception staff to acknowledge you - 	although we attempted to make eye contact and greet them each morning etc, only one lady made any acknowledgement in return.	In general, staff turned away unless checking in a guest and this was noted by others in their reviews.	Did it impact our stay?	Not really, 	but it did create a bizarre atmosphere where we didn't like to approach the staff for advice on trains, restaurants etc which we would normally do to seek local recommendations.
This hotel has a god location since it is near the train station.	You just cross the street.	If you have to change trains, it is very convenient.	The people at the reception a re very nice and helpful.	The breakfast was good too, quite varied.	From the hotel you walk straight down the main road and you are at the Pisa tower.	It is a 30 minutes walk more or less, quite easy to reach.sometimes the people living in the hotel can be loud and the insulation is not 100%.The hotel was a bit overpriced.
If you are flying into Pisa, you can purchase Pisa Mover bus tickets €1.60 at the airport and travel by bus to the train station.	If you purchase the tickets on the bus they are €2.	From the bus walk through the train station via the underpass and the hotel is directly opposite.	This was an average convenient hotel suitable for further travel - Florence is 1 hour away and €16 euros return The hotel reception staff were helpful, 	but facilities are basic.	There are simple foods available in the lobby to purchase ie tea, coffee sandwiches, 	but there are plenty of local bistros which are much better value.	The room had no tea coffee making facilities - so you need to have something - juice/water with you.	The room was clean, it would have been helpful to have a printed list of the tv channels, and you need to check the air con...it switches itself off, and the wifi is temperamental Breakfast was a mixture of cereals, pastries, eggs/bacon/cheese/ ham and fruits The hotel is an easy stroll from the tower
Due to a train strike our travel plans were derailed and we needed to find a hotel in Pisa at short notice, for an overnight stay prior to flying from Pisa airport the next day.	Booked this hotel primarily for its location (opposite train station so v close to airport shuttle bus).	Good quality, particularly the recption area which looked quite classy and recently done up.	R oom was standard 4 star type, with excellent shower.	Given location, was concerned there might be traffic noise, 	but spent a very peaceful night.	Town centre for shopping is a short stroll, with the Tower etc a fair bit further, 	but a pleasant walk nontheless.	Would stay here again.
This hotel was fabulous, it is modern with a contemporary twist, clean and very comfortable.	Our room was a double superior, the beds were very comfy with beautiful comfy pillows, a mini bar, tea and coffee making facilities.	A fabulous shower over the bath, couldn't fault this hotel at all.	Breakfast was a very good selection of cereals, yogurts, fruit, ham, cheeses, eggs, bacon, pastries.	Our room overlooked the Central station which is ideal if you want to travel to different areas.	20 mins to Lucca and 1 hour to Florence.	A 20 - 30 minute walk takes you to the famous Leaning Tower which is fabulous!	Lots of bars and restaurants close to the hotel and beautiful shops.	Stayed here with a friend for her 60 th birthday.	Really good value, stayed 3 nights.
My wife and I with friends enjoyed our one night stay and highly recommend the NH Pisa.	Good location opposite the railway station and within walking distance of the major sights and restaurants.	The rooms are comfortable, very clean, nicely furnished and spacious.	A wonderful and substantial breakfast buffet is included.	We would certainly stay there again.
Best for location: 10 mins on shuttle from airport, right opposite main train station and 15 mins walk into main square.	Reception staff are friendly and the hotel is generally clean.	The room was fairly small - similar size to an IBIS budget Synthetic breakfast a bit worse than that we got on the plane.
