Located directly outside Pisa train station, this hotel is very easy to find.	Tourist spots like Leaning Tower are about a 20 minute walk away.	The staff are ok, some friendly, some a bit abrupt.	They expect payment on check-in, cash or card.	The rooms are adequate, the air-conditioning is intermittent and takes time to figure out how to turn it on.	It says free Wifi 	but it never worked for us.	There is NO safe in the room and you have to hand your key to reception every time you leave hotel, so leaving valuables in the room is a risk.	We padlocked everything in our case and put it under the bed.	Room has a fridge 	but buy drinks outside hotel and put them in there yourself.	Bed is reasonably comfy, bit hard and only 3 pillows.	Hotel can get a bit noisy at night, the reception is echoey and the people above us were restless for some reason.	Breakfast was quite good actually.	7:30-10:00: tea and coffee, juice, fresh water, bread, meats, cereals, yoghurts, pastries, even scrambled egg and sausages.	This made a difference.They lock reception after midnight, so make sure you get the code for the side gate if staying out later than that.Check-out 10:30.	Overall it's a hit and miss hotel 	but does the job for the price.
Hotel is very close to Station  bus services.	Rooms are cheap 	but still have air-conditioning  Staff are very friendly.	Breakfast is good.	Overall a wonderful place to stay with easy access to Pisa (via walking or buses) or further afield via trains.	First room we were given had broken shutters that couldn't be used 	but staff moved us within half an hour.Would thoroughly recommend for anyone looking for cheap accommodation with easy access.
Over priced and mis-informed upon arrival.	i.e.	We were under the impression we had booked with parking and breakfast included 	but had not so this resulted in an additional 35 euro per night we were not anticipating.	For $250 cdn per night we are confident there are much more sufficient accommodations.SleepingWe had a family room with 5 x single beds.	The beds were uncomfortable and the area was very noisy.	Street traffic is loud and near reciption or even on the next floor, you hear everything.	The walls are thin.	The positive 	though is that the airconditioning works well which is essential for a stay in Italy in the summer.BreakfastBreakfast is an additional $5 euro per person and must be booked the night before.	We confirmed with multiple staff and still nothing was left and they were not expecting us.	The staff &quot;informed&quot; us that there was an Asian tour group that morning and that &quot;they always eat everything&quot; plus they were not expecting us (family of 4).	Obviously this is not our issue and nor an acceptionable/professional response.	We confirmed with staff that breakfast was served until 9:30am and informed them we would not be attending breakfast until 9am.	Still, there was limited (not enough to feed 1 person) of cold bacon and eggs left.	Apparently they cook one batch at 7:15am and let it sit.	They do not replenish.	If you arrive at 7:15am, breakfast is worth it... any later and it is not unless they change their practices.	StaffStaff are friendly and the male staff in particular goes out of his to assist and speaks very good English.	Location1 minute walk to the train station and 10 minute walk to the tower (with a 5 and 7 year old).	Cleanliness  FunctionalityClean.	The floors could be better swept 	but no concern as for cleanliness.	The shower is warm and offers good water pressure.	Linens we're fresh upon arrival 	but are not changed daily (anticipated with a 2-star hotel).	To maintain electricity, you need to leave a card in the slot by the door.	This does not need to be the card with the key - it can be an Air Miles card.	The toilet barely functions.	You need to hold the button and try 3 times to actually fully flush the toilet.	The fridge did not work.	OverallWe would not book again and would explore other options in the future.	That said, if your options are limited and you are simply looking for a place to crash at night, this is adequate.
we had a very nice experience in this hotel with my family.	a very warm welcome buy the owners and very helpful.	good breakfast for the value paid and served with hot croissants.
I stayed here for one night before catching an early morning flight from Pisa airport.	Location is very convenient to the train station, where you can catch a quick and easy train directly to the airport.	Staff at the front desk wern't particularly friendly, and my room wasn't very clean (the table was sticky and obviously hadn't been wiped down).	Wouldn't want to stay longer than one night - 	but the convenience made it passable.
In august our extended family group(11) spent one night at the hotel roseto before travelling on to barga for a villa holiday.	the hotel was idealy situated close to the railway station for travel to florence, and for restuarants, etc...  the staff were very friendly and helpful.	we had hired cars and the hotel had off street enclosed parking for a small fee which put our minds at rest.	our stay also included buffet breakfast taken in a small dining room or in a sunny courtyard (most enjoyable)  We all enjoyed our stay clean airconditioned rooms and would definately stay there again when in Pisa
This hotel is very well located.	It was very easy for me as a touris to get arround the city thanks to the train station and the bus station.Besides, the price was good, my room was always very neat and the staff Gimmi, Maurizio, Antonella were really nice with me.	They were all the time asking me about my stay here, the were veyr attantive and respectful.
I picked this hotel because it will be convenient for me to take my morning train on the next day to Florence.	The hotel situated very near to the train station.	It is also within walking distance to bus station and local restaurants.	The hotel price is cheap and the room is small 	but good enough for a backpacker like me.
This was my 2nd stay at this hotel (prev.	2010) There has been a drop in their reception staff standards since my earlier visit when I was allocated a ground floor room.	There is no elevator, lift, to the 1st floor rooms, so lugging heavy baggage is difficult for a 70's man.	The stairs and corridor were in darkness until a motion sensor eventually brought the lights on.In October 2015 I was allocated 1st floor room 13, facing a side street.	The room was just ample for a man on his own.	It was serviced every day and the bathroom was always clean with fresh towels.	As a word of warning to travellers, and I hope the hotel management, the polished marble floor in the room 13 bathroom is a great hazard for slips and falls - equally bad is the polished marble floor in the bedroom: This means any wet feet will cause you to slip....and a nasty way to end a holiday far from home (I am in Australia) with broken bones or wrist!	Nothing bad happened to me I am glad to report.The breakfast offered was average in variety, 	but sufficient.Travellers may like to know it is a 25 to 30 minute level walk from the hotel to the Leaning Tower of Pisa complex.
I spend one night in this hotel, solo in a single room closed to the reception desk.first the receptionist was a bit intrusive and called me in my room, asking my number.	he should stay professional and that's enough.then the room is tiny, impossible to breath because with a strange humid smell.	the AC didn't work.	the internet is poor, only for one device and you need to re-log every 10 min … !!	!this night, it started to rain and then impossible to closed an eye!	such a noise on the room that i tough the water would came in.	I looked for someone at the desk and there was nobody, the door for outside were looked !	this is totally crasy.	the worst hotel in my life, nightmare!
I stayed in this hotel for one night for a weekend trip to Pisa.	I was traveling alone and I would not recommend this hotel to any woman traveling alone.	During the check-in the (male) receptionist asked me very inappropriate questions such as if I am married, if I like to go dancing and to drink beer and in the end also if I liked violent men which I found very disturbing.	Needless to say, I was terrified and did not sleep very well that night.	Apart from being disrespected by the receptionist, the window did not open, there where holes in the sheets and it was very noisy at night.	In addition the Wi-Fi did not work.Don't sleep here unless you really have to.
The location of the hotel is excellent as it is located directly opposite Pisa's central train station.However,I found the staff were particularly unhelpful and rather ponderous.In addition,the breakfast provided was bland and very basic.I would definitely not stay there again.
This hotel is a budget option.	It is next to the train station and within walking distance to the Leaning Tower.	The room was very clean.	AC worked well.	The beds were comfortable.	The staff was nice and helpful.	It isn't cute or pretty 	though, and doesn't have any atmosphere at all.	Parking is in a locked lot next door for $15/day.	They also rent bikes in the lot.	Breakfast is extra 	but we didn't eat there.	There are several little bake
The location is just next to train station, also pisa is not very big city so you can walk to the monuments if you feel like.The room was nice and comfortable.The breakfast was not so fresh could be improved.
We booked one night on a overnight stay in Pisa, the only hotel available on net.What a find, opposite the station, close to everything, the staff were excellent, good Italian breakfast included in the price.	The room was not very big, 	but had private bathroom.	Very clean, not dust found anywhere.	WILL stay here again.The only down fall is that being so close to the station is that there are always some dodgy characters hanging around the station area.	BUt you find that in every city....
The Hotel is very convenient for the independent traveller, Pisa airport connects directly to the City (about 10 minutes on the train) and the train station  is just two minutes walk from the Hotel.The area round the train station is at best a bit scruffy, and the hotel fits in well!However the rooms are adeqaute, they offer a quad room which is great for families, and the breakfast, 	although not 5* is sufficient to fill you up before the day.	I never did crack the coffee machine, whatever you select you get the same drink.The main sights are a half hour walk away, 	but a walk that is interesting and tasteful, the nearer the tower you get the more expensive everything is - 	but that is no great shock.
No elevator, we did not get any help to carry our heavy bags upstairs.	We did not get advice from the reception of how to use the lights in the room and we asked the cleaner who was helpful.	The staff at the reception did not smile or talk much.	The lady 	though gave us advise how to go the tourist information center and recommended a bus than a train to go to Viareggio because of a train accident.The breakfast was okey with also cheese and ham.	There was a TV in the breakfast room.The colours in the hotel were terrible orange, green..	The room was small.	There was no noise of traffic to our room, so we could sleep quite well.	The bathroom was terrible.	When it got wet, the smell was awful...	There is mould.Location is close to railway station.	There is an afro-asian shop in the same street 	but also an elegant wine shop.	I do not know if the area is safe late at night.	It was easy to reach the hotel when we came from Florence by train.	We also took a train to the Pisa airport when leaving.	There were only three passengers in the morning.	We did not see any taxis at the taxi station.We walked to the Pisa tower, 	but there are also buses.	In tourist information they guided us a nice way to walk there.	There is not a long way to a shopping street from the hotel and there were also some restaurants some steps away.From a bus station we bought tickets to Viareggio beach resort.	The bus stop was not far from our hotel.	The buses were full of beach vendors when we came back and the bus was very hot.	So, do not wait until the last bus.	Luckily the driver opened the door while driving.
In a very convenient location close to the train station and approximately a 20 minute walk to the leaning tower.	Our room had been recently renovated and was clean and very quiet (with the exception of our neighbors).	The breakfast was plentiful and the staff were very helpful.	I would recommend this hotel for those staying 1 or 2 nights in Pisa.
Lovely room, plenty of drawers and hanging space, our breakfast was included, nothi flash 	but adequate, and the staff were very friendly and helpful.	We loved our room,the shower was small, so not good for larger persons!	!This hotel has no lifts, so stairs could be a problem for some.	Right next to the main station, great location, we walked everywhere from here quite easily, then train to Airport Leave lots of time to catch train, 	although only one stop to airport, took us nearly an hour to get the train, cancellations, change of platform two minutes before scheduled departure, then of course big delay as everyone exchanged trains!
Stayed here for 3 nights for a surprise weekend away.	My husband booked this hotel as it was close to the train station and was a reasonable price.	When we arrived he siad the pictures were mis-leading, and having seen photos myself now on bookings.com I would agree - our room and bathroom were alot smaller then the pictures suggest.	Having said that, it was perfectly fine for the price.	Very close to the station 	but wasn't disturbed from any outside noise at all.	Most of the noise (which was minimal) came from the staff setting out breakfast in the morning.	The room was basic and small, 	but clean, Breakfast was a bit disappointing.	The first morning they had run out of bread.	Tea, coffee and fruit juice are provided with a selection or strange pastries.	No croissants or bread rolls with meat and cheese as you would expect on the continent.	Fruit was apples and oranges - maybe we weren't at the right time of year for the lovely fresh fruit other people have mentioned!	I would recommend this for a budget traveller if you want somewhere cheap and convenient for a few nights.	All the sights in Pisa are within half an hours walk.
I spent a night in Hotel Rosetto, October 16/17, 2012.	I had room 13, a real single, very small 	but not suffocating.	Room was acceptable and the hotel was half-way between the train and the bus station, very convenient for me since I reached Pisa in the evening by plane and then train and leaved early next morning by bus.	The persons at the reception (both in the evening and in the morning were kind enough to help carrying my suitcase on the stairs (no elevator).	All in all, I have no complains about the room except the fact that I thought that it was too expensive at 55 eur/night, at the end of the tourist season.
This hotel is 2 minutes from Pisa Central (out the front of station and diagonal left), in the perfect position for arriving by train and flying out.The staff were delightful, friendly and very helpful.	Rooms were large, clean and quiet.	Would definitely stay there again and very happy to recommend.	So perfect.	Just one grumble, I would have liked a blanket in the room as an extra (I feel the cold).	Thank you to the young man who made the breakfasts, we really appreciated your help in getting us on our way early.Maureen and Richard Australia
This was a five minute walk from the train station so it was very convenient for us as we were leaving the next day for Bologna.	We only stayed one night 	but had no problems with the hotel.	The front desk staff was courteous and spoke English.	The room was smallish 	but all of the rooms that we stayed in were as well and clean.	Everything functioned just fine in the room, and there was absolutely no noise from the train station.	We had a small balcony and could let some air in the room, we couldn't figure out the air conditioning 	but it didn't matter as the night was nicely cool.	All in all a very good value for the money especially if you want to be able to get to the train station quickly.
We had a double room for my parents and a single room for me.	The single was a little small 	but perfectly cosy and just what I needed!	The double was very spacious, with a balcony a nice bathroom.	Showers not baths 	but for that time of year it wasn't a problem.	Staff were very friendly 	though they didn't speak english.	We spoke some Italian and they were very good about it.	The hotel is close to the station and airport 	but equally not far from all the sites.
I had lost the business card for this lovely little hotel and finally found the info again to write this review 	but the people at this hotel saved my group and I from what could have been a very interesting night.	We are all college students who had been traveling for a month around Europe and we had one flight (RyanAir, so random airports) that got us into Pisa at 12am.	We were then planning to leave the next morning to Florence so figuring we could stay in the airport we didn&#39;t book any hostel or hotel for the night.	We were a group of two girls and four guys, so a decent sized group so when we were told the airport was closing we were a little lost as to what to do.	We then decided to walk to the train station with our big backpacking bags and try to stay the night there.	When we got there, we came to encounter may very sketchy looking people and were pretty sure if we went to sleep we would get robbed.	Really lost at this point we decided to lug our bags around and see if we could find a place to stay (1:30am at this point).	We checked many hotels for both rooms and just places to keep our bags and not one place was willing to help us out until we got here.	The staff at this hotel...</span><span class=fullText hidden data-hiddenOnPageLoad=true>I had lost the business card for this lovely little hotel and finally found the info again to write this review 	but the people at this hotel saved my group and I from what could have been a very interesting night.	We are all college students who had been traveling for a month around Europe and we had one flight (RyanAir, so random airports) that got us into Pisa at 12am.	We were then planning to leave the next morning to Florence so figuring we could stay in the airport we didn't book any hostel or hotel for the night.	We were a group of two girls and four guys, so a decent sized group so when we were told the airport was closing we were a little lost as to what to do.	We then decided to walk to the train station with our big backpacking bags and try to stay the night there.	When we got there, we came to encounter may very sketchy looking people and were pretty sure if we went to sleep we would get robbed.	Really lost at this point we decided to lug our bags around and see if we could find a place to stay (1:30am at this point).	We checked many hotels for both rooms and just places to keep our bags and not one place was willing to help us out until we got here.	The staff at this hotel were BEYOND incredible!!!!	Not only did they try to find a room for us 	even though they were fully booked 	but they let us store our luggage for FREE.	They let us use their lobby bathroom to change and treated us like we were family in a way.	Being able to drop our bags we decided why not to just stay up and explore the city.	We ended up finding a 24 hour coffee shop where I guess the street kids hang out (pretty funny scene) that changes their coffee price from 2 euros to 7,50 euros between 1am and 7am 	but we wondered over and saw one of the most incredible things I have ever seen.	We saw the Leaning Tower of Pisa at 5am with just us.	It was beautiful.	A tourist trap location with no one around.	Without the lovely hospitality we experienced at this hotel, I would have a very different view of Pisa today.	It also had a great location and yummy breakfast for I think only 8 euros without a room purchase.	I don't know what the rooms are like 	but I do know that the staff would do ANYTHING within their power to make your stay the best it could possibly be.	I would highly recommend staying here.</span><span class=taLnk ulBlueLinks moreBtn onclick=widgetEvCall('handlers.clickExpand', event, this);>More</span>
Stayed at Hotel Roseto whilst in Pisa , i recommend it and will stay again.	The rooms were spotless and big, must have been refurbished recently.	Had air con, which was a relief as the weather had been so hot, the breakfast abundant, with a range of food from fresh fruit to a home made cake.	The location is fantastic as its just across the road from the station  and not far from the city centre.	All the staff were lovely and  the owner was fantastic, so friendly , kind and helpful, felt like i was at home.	Great work Hotel Roseto !	Grazie !
Perfectly pleasant hotel near the train station.	The room was a decent size for 4 people.	The area around the hotel was pretty typical for being close to the train station.	We came back to our room about 10:30 and passed 2 vagrants.	Across from our hotel was a liquor store where a group of young men drinking bottles of booze out of paper bags had congregated.	We crossed the street to avoid any trouble.	The hotel staff was friendly and helpful.	Breakfast was dissapointing.	The croissants were dry and stale.	The pan of scrambled eggs were burnt.	The price was on the lower end of the various hotels I looked at.	Next time I might look for something with a bit more ambience in a different part of town depending upon the price.
The room - clean, massive TV, ensuite bathroom.Location - Quite easy to access main sites, 	but far enough from center to be accessible by car without too much stress.	Sat Nav recommended.	Best Bit - Cheap and ChearfulNot so good - coffee, breakfast.Summary - serves it purpose.	Probably wouldn't want to stay there for very long.
We arrived very late to Pisa Central Train Sta.	and were immediately concerned with the safety of the area around the station.	The hotel is a stones'-throw from the station and we never really felt good about our choice (booked online).	The room was plenty large enough for us and we toughed-out the night.	We changed hotels the second night and were much happier.	You get what you pay for, and at the Roseto that means thin walls, stained bedspread (with a patch sewn in for good measure), a strange odor and really odd towels.	I must admit that the hotel and area looked much better in daylight, 	but it just wasn't for us.
Great location also and staff very friendly.	We only stayed two nights 	but found it very accessible and all we required for a short stopover.	Clean and roomy we didn't take meals here so can't comment.	The hotel us situated right across from the railway station and taxi rank also.	As there was upgrade work being carried out we found it noisy 	though.
Lovely little BB, beautifully 	but simply decorated with understated elegance and charm.	Down a rather shabby little side street 	but very close to the station and nice and quiet.	The place was spotless and comfortable, with lots of little extra touches that made us feel at home.	Romeo, the host / owner was very friendly and helpful, recommended an excellent little local restaurant just down the road and made us feel welcome and relaxed.	I'd stay there again if I return to Pisa.
Great location, near to everything, the owner is extremely helpful and the rooms are really clean.	They don't look like guest rooms, you have the feeling of sleeping at a friend's house.	Toilets (2) in common 	but well equipped.	Breakfast: croissants, joghurt coffee, cappuccino.	Not an hotel 	but compaired to other places nearby it is one of the best options.	Easy to find a parking nearby.	Not noisy, you can sleep good (Pisa has many universities, so sometimes it is really noisy).
We had a long stay between flights so we booked a night here.	It was lovely, clean, good location and the owners were most helpful and friendly!	The place was very clean, the shared bathroom was only called shared 	but was used by our party only.	We had a great night sleep, it was very quiet.	Will recommend to friends and family!
We stay there for 2 nights,1 day.	The personal was friendly.	The room ( double bed room standard ) was small.	Good bathroom.	Price of the minibar was very high.	Parking place cost 20 euro for 1 night.
Would definitely visit again.	Very impressed with the whole experience of staying in Italy.	Exceptionally helpful staff, well recommend a trip to Florence.	We travelled return to Florence for just under 35€, clean trains, train station was directly opposite the hotel.	Leaning tower was an easy walk from the hotel approx.	A 20 minute stroll.	Lots of fab eateries, bars, gelato shops and shopping.......shopping with mega sales....oh and shopping.	NH Pisa was brilliant and we will be returning with friends and family in tow.	Recommend a Ponce from the bar at the square by the river on the way to the learning tower.	Also recommend the ice cream at the gelato shop next to the bar.	Investigate the roads off of the high street stretch also as there are some lovely restaurants and bars all around.	We found a lovely restaurant on Valentine's night that we hadn't booked who were very accommodating.	Our meal .. seafood spaghetti and steak (800g t bone) was exceptional with a huge range of wine on the wine list.	The whole meal came to just under 70€ it was amazing so much so that we returned to eat another meal two evenings later.	A fab little break away, we didn't want to come home and will be returning again.	Very soon!
We stayed for 1 night only.	Room was clean.	Buffet breakfast was good.	Lots of option for cold  hot food.	The location is the best, airport  Pisa tower can be reached by foot.There are lots of food shops in this area,
